date_requested,uuid,title,description,keywords,snippet,url,image_url,language,published_at,source,relevance_score,ticker
2024-02-22,53abfb6d-d283-4fa7-878a-e2a877f3ba62,"Nvidia’s surge ripples across stock market — lifting AI, tech and semiconductor ETFs",Several exchange-traded funds that buy stocks with exposure to artificial intelligence surged Thursday after closely watched AI beneficiary Nvidia Corp. beat...,"article_normal, stocks, ai, nvidia, etf, tech, Computers/Electronics, Software, Artificial Intelligence Technologies, Semiconductors, Banking, Trusts/Funds/Financial Vehicles, Financial Investment Services, Market Research/Public Relations, Public Relations, Advertising/Marketing/Public Relations, Business/Consumer Services, Banking/Credit, Computing, Computer Hardware, Exchange Traded Funds, Financial Services, Industrial Electronics, Industrial Goods, Internet/Online Services, Integrated Circuits, Investing/Securities, Technology, Graphics Processing Units, Private Banking/Wealth Management, Financial Performance, Ownership Changes, Acquisitions/Mergers/Shareholdings, Information Technology, Corporate Actions, Corporate/Industrial News, Artificial Intelligence/Machine Learning, Political/General News, Computer Science, Sciences/Humanities, Equity Markets, Fund Markets, Commodity/Financial Market News, Content Types, Factiva Filters, C&E Exclusion Filter, C&E Industry News Filter, AI, Nvidia, ETF, NVIDIA Corp., NVDA, Invesco AI & Next Gen Software ETF, IGPT, Vanguard Information Technology ETF, VGT, Roundhill Magnificent Seven ETF, MAGS, iShares U.S. Technology ETF, IYW, Roundhill Generative AI & Technology ETF, CHAT, Global X Artificial Intelligence & Technology ETF, AIQ, Global X Robotics & Artificial Intelligence ETF, BOTZ, ROBO Global Robotics & Automation Index ETF, ROBO, WisdomTree Artificial Intelligence & Innovation Fund, WTAI, VanEck Semiconductor ETF, SMH, ROBO Global Artificial Intelligence ETF, THNQ, iShares Robotics & Artificial Intelligence Multisector ETF, IRBO, Technology Select Sector SPDR ETF, XLK, iShares Semiconductor ETF, SOXX, S&P 500 Information Technology Sector Index, XX:SP500.45, financial performance, ownership changes, acquisitions, mergers, shareholdings, information technology, corporate actions, corporate, industrial news, artificial intelligence, machine learning, political, general news, computer science, sciences, humanities, equity markets, fund markets, commodity, financial market news, content types, factiva filters, c&e exclusion filter, c&e industry news filter, computers, electronics, software, artificial intelligence technologies, semiconductors, banking, trusts, funds, financial vehicles, financial investment services, market research, public relations, advertising, marketing, business, consumer services, credit, computing, computer hardware, exchange traded funds, financial services, industrial electronics, industrial goods, internet, online services, integrated circuits, investing, securities, technology, graphics processing units, private banking, wealth management",Several exchange-traded funds that buy stocks with exposure to artificial intelligence surged Thursday after closely watched AI beneficiary Nvidia Corp. beat ea...,https://www.marketwatch.com/story/nvidias-surge-ripples-across-stock-market-lifting-ai-tech-and-semiconductor-etfs-69f6e766?g=ada1d742-0897-4736-a074-bd9cddf0a526&mod=mw_rss_bulletins,https://images.mktw.net/im-89200862/social,en,2024-02-22 22:11:53+00:00,marketwatch.com,,AAPL
2024-02-22,1cdf3b18-b119-4b97-b44c-3962bb65a44b,Nvidia adds $372 billion in stock market value in Wall Street’s biggest one-day gain in history,The rise in Nvidia’s market value on Feb 22 eclipsed the entire value of Coca-Cola. Read more at straitstimes.com.,,"OAKLAND, California - Nvidia added US$277 billion (S$372 billion) in stock market value on Feb 22, Wall Street’s largest one-day gain in history after the hea...",https://www.straitstimes.com/business/nvidia-adds-372-billion-in-stock-market-value-in-wall-street-s-biggest-one-day-gain-in-history,https://static1.straitstimes.com.sg/s3fs-public/styles/large30x20/public/articles/2024/02/23/2024-02-22T122001Z1403033189RC2KOZ9WD1J2RTRMADP3NVIDIA-RESULTS-FRANKFURT-SHARES.JPG,en,2024-02-22 23:17:00+00:00,straitstimes.com,,AAPL
2024-02-22,e19661e6-e94e-45a4-93eb-c1bee27ea900,Adobe: Do Not Ignore Figma And The Long-Term Gen AI Threat (NASDAQ:ADBE),"Adobe Inc. stock underperforms market, cancels Figma acquisition. Questions remain on its high valuation. Click for my ADBE update amidst all the turmoil.",,"Frazao Studio Latino/E+ via Getty Images

Adobe Inc. (NASDAQ:ADBE) was a big winner in 2023, as the company benefited from both a broader tech recovery as well ...",https://seekingalpha.com/article/4672663-adobe-do-not-ignore-figma-and-the-long-term-gen-ai-threat,https://media.gettyimages.com/id/1480560243/photo/young-man-drawing-on-a-paper-at-tattoo-studio.jpg?b=1&s=170667a&w=0&k=20&c=GNDNhW7iRflZA1N8IV1mSAq1LBlbzugd9Yh8x3DBk-U=,en,2024-02-22 23:44:08+00:00,seekingalpha.com,,AAPL
2024-03-05,4ad9573e-9020-44cd-9e18-c9c24b522c5c,"Market Today: CrowdStrike Soars on Earnings Beat, ChargePoint Tumbles After Disappointing Results","Market Overview The stock market experienced a downturn, with major indices falling over 1.0%, led by a decline in tech stocks. The drop was more pronounced in","GuruFocus, Article, News, GuruFocus Research, CRWD, CHPT, TSLA, AAPL, JWN, MDB, ROST, ARDX, PLTR, SOFI, ALB, BOX","Market Overview

The stock market experienced a downturn, with major indices falling over 1.0%, led by a decline in tech stocks. The drop was more pronounced in...",https://www.gurufocus.com/news/2373691/market-today-crowdstrike-soars-on-earnings-beat-chargepoint-tumbles-after-disappointing-results,https://static.gurufocus.com/1732803573856661504.png,en,2024-03-05 22:40:28+00:00,gurufocus.com,,AAPL
2024-03-05,0883e662-3559-47e7-885d-f872f948b893,Asia Stocks Set for Mixed Open After US Tech Slide: Markets Wrap,Stocks in Asia were set for a mixed open after tech heavyweights dragged down US indexes in the run-up to Federal Reserve Chair Jerome Powell’s testimony to…,,"This advertisement has not loaded yet, but your article continues below.

Asia Stocks Set for Mixed Open After US Tech Slide: Markets Wrap Stocks in Asia were s...",https://financialpost.com/pmn/business-pmn/asia-stocks-set-for-mixed-open-after-us-tech-slide-markets-wrap,https://smartcdn.gprod.postmedia.digital/financialpost/wp-content/uploads/2024/03/us-spot-etfs-help-drive-bitcoin-to-a-record-high.jpg,en,2024-03-05 23:07:09+00:00,financialpost.com,,AAPL
2024-03-05,daa840df-b288-4add-9b7a-459220eddc40,Dow Jones Futures: Face-Ripping CrowdStrike Rally To The Rescue; Fed Chief Powell On Tap,Dow Jones futures: CrowdStrike surged on earnings after software and bitcoin plays led Tuesday's sell-off. Fed chief Jerome Powell is on tap.,,"Dow Jones futures were little changed after hours, along with S&P 500 futures and Nasdaq futures. CrowdStrike (CRWD) soared overnight, headlining key earnings r...",https://www.investors.com/market-trend/stock-market-today/dow-jones-futures-crowdstrike-soars-bitcoin-hit-fed-chief-powell-on-tap/?src=A00220&yptr=yahoo,https://www.investors.com/wp-content/uploads/2022/06/Stock-jeromepowell2022-05-gov.jpg,en,2024-03-05 23:14:10+00:00,finance.yahoo.com,,AAPL
2024-03-12,b9ec8186-d086-46c5-bfc3-871894a9a803,General Motors' executive vice president for software and services Mike Abbott to step down By Reuters,General Motors' executive vice president for software and services Mike Abbott to step down,,"Published Mar 12, 2024 05:29PM ET Updated Mar 12, 2024 05:56PM ET

© Reuters. FILE PHOTO: The new GM logo is seen on the facade of the General Motors headquart...",https://www.investing.com/news/stock-market-news/general-motors-executive-vice-president-for-software-and-services-mike-abbott-to-step-down-3335089,https://i-invdn-com.investing.com/news/LYNXMPEB2O03P_L.jpg,en,2024-03-12 21:31:20+00:00,investing.com,,AAPL
2024-03-12,04e2da53-1410-46bb-9b5d-d1006302093c,Zscaler: This Is A Dip Well Worth Buying (NASDAQ:ZS),Zscaler has unveiled several products based on AI which are being used to identify threats and to create remediation strategies. Learn more on ZS stock here.,,"Michael Vi

The case to buy Zscaler shares now

Has the long awaited consolidation trade finally arrived? Tuesday, March 5th, was not a pleasant day on which to...",https://seekingalpha.com/article/4677735-zscaler-this-is-a-dip-well-worth-buying,https://static.seekingalpha.com/cdn/s3/uploads/getty_images/1310211442/image_1310211442.jpg?io=getty-c-w1536,en,2024-03-12 22:13:34+00:00,seekingalpha.com,,AAPL
2024-03-12,0aab2e29-11cf-49b7-8561-37903d2d8476,Arm Rival SiFive Expects Licensing Revenue to Surge This Year,"(Bloomberg) -- SiFive Inc., a money-losing chip designer that competes with Arm Holdings Plc, expects to boost its licensing revenue to $60 million this year while striking at least $180 million worth of lifetime royalty deals.Most Read from BloombergStock Traders Bracing for Worst Shrug Off Hot CPI: Markets WrapOne of the Most Infamous Trades on Wall Street Is Roaring BackChina Has Never Canceled This Many Shipments of US WheatUS Core Inflation Tops Forecasts Again, Reinforcing Fed CautionEx-Wa",,"(Bloomberg) -- SiFive Inc., a money-losing chip designer that competes with Arm Holdings Plc, expects to boost its licensing revenue to $60 million this year wh...",https://finance.yahoo.com/news/arm-rival-sifive-expects-licensing-221723705.html?.tsrc=rss,https://s.yimg.com/ny/api/res/1.2/OqxWbCXtvrbq0zrh28lY1w--/YXBwaWQ9aGlnaGxhbmRlcjt3PTEyMDA7aD04MDA-/https://media.zenfs.com/en/bloomberg_markets_842/09e1ee7c4868cb3d273486bad2d2c986,en,2024-03-12 22:17:23+00:00,finance.yahoo.com,,AAPL
2024-03-14,4d9e762e-f6d4-4100-8071-d9de235346af,Market Open: Brace yourselves for ASX200 fall,Futures have been pointing to a 0.7 per cent drop after all US markets closed in the red off the back of higher-than-expected inflation data.,,"Join our daily newsletter At The Bell to receive exclusive market insights

ASX200 investors: Brace yourselves for market falls today!

Futures have been pointi...",https://themarketonline.com.au/market-open-brace-yourselves-for-asx200-fall-2024-03-15/,https://themarketonline.com.au/wp-content/uploads/2024/02/og-49094-Thumb-MO-1280x720.jpg,en,2024-03-14 22:18:45+00:00,themarketherald.com.au,,AAPL
2024-03-14,cc835514-5889-4799-bd15-23c3371143fd,"Market Today: FDA Approves First NASH Therapy, Adobe and Ulta Beauty Report Earnings","Market Overview
The stock market experienced a downturn, with the S&P 500 (-0.3%), Nasdaq Composite (-0.3%), and Dow Jones Industrial Average (-0.4%) all closin","GuruFocus, Article, News, GuruFocus Research, MDGL, ADBE, ULTA, AAPL, ARCC, GERN, KODK, MO, VLO, PD, PATH, CDLX, BA, ENPH, AAPL, MSFT, AMZN, GOOG","Market Overview

The stock market experienced a downturn, with the S&P 500 (-0.3%), Nasdaq Composite (-0.3%), and Dow Jones Industrial Average (-0.4%) all closi...",https://www.gurufocus.com/news/2383968/market-today-fda-approves-first-nash-therapy-adobe-and-ulta-beauty-report-earnings,https://static.gurufocus.com/1732803573856661504.png,en,2024-03-14 22:40:31+00:00,gurufocus.com,,AAPL
2024-03-14,b54f57bf-ccb6-4ccd-b01c-acacf5376ca6,Earnings call: Build-A-Bear Workshop sees record results for the fourth quarter By Investing.com,Earnings call: Build-A-Bear Workshop sees record results for the fourth quarter,,"Published Mar 14, 2024 07:53PM ET

© Reuters.

BBW +16.08% Add to/Remove from Watchlist

Build-A-Bear Workshop (NYSE: BBW) has announced another year of record...",https://www.investing.com/news/stock-market-news/earnings-call-buildabear-workshop-sees-record-results-for-the-fourth-quarter-93CH-3339137,https://i-invdn-com.investing.com/news/LYNXNPEB9M0BY_L.jpg,en,2024-03-14 23:53:33+00:00,investing.com,,AAPL
2024-04-30,c40bd833-932e-4b53-9e58-41f2fe3d279e,Stocks Sink In April As Inflation Fears Rise,"The S&P 500 fell significantly in April, giving back a chunk of this year's gains. Read why volatility will reign given uncertainty with the Fed and earnings.",,"Matteo Colombo

In what has become a rare occurrence on Wall Street, the S&P 500 fell significantly in April. Coming into the month, the SPX had been up nine of...",https://seekingalpha.com/article/4687696-stocks-sink-in-april-as-inflation-fears-rise,https://static.seekingalpha.com/cdn/s3/uploads/getty_images/668600179/image_668600179.jpg?io=getty-c-w1536,en,2024-04-30 20:45:52+00:00,seekingalpha.com,,AAPL
2024-04-30,536364cc-6462-43c3-be03-ed1d38be9d47,"Is It Over, Or Just A Dead Cat Bounce?","The S&P 500 rebounded by nearly 4% after a 7% pullback, but uncertainty remains about whether the correction is over or not. Explore more details here.",,"PM Images

The S&P 500 Index (SP500, SPX) rebounded considerably, bouncing by nearly 4%. The recovery comes after a broad market pullback of roughly 7% (peak to...",https://seekingalpha.com/article/4687725-is-it-over-or-just-a-dead-cat-bounce,https://static.seekingalpha.com/cdn/s3/uploads/getty_images/1072593728/image_1072593728.jpg?io=getty-c-w1536,en,2024-04-30 21:19:00+00:00,seekingalpha.com,,AAPL
2024-04-30,cd40a03a-5bc7-44c4-82c9-8aa16371bb33,Elfun Trusts Energizes Portfolio with CMS Energy Corp Stake,"Insight into Elfun Trusts (Trades, Portfolio)' Q1 2024 Investment Moves and Stock Adjustments

Elfun Trusts (Trades, Portfolio), a fund with exclusive access fo","GuruFocus, Article, News, GuruFocus Research, MSFT, NVDA, AMZN, AAPL, META, CMS, ULTA, ADBE, ON, AMT, NEE, COST, WM","Insight into Elfun Trusts Trades, Portfolio)' Q1 2024 Investment Moves and Stock Adjustments

Elfun Trusts (Trades, Portfolio), a fund with exclusive access for...",https://www.gurufocus.com/news/2422582/elfun-trusts-energizes-portfolio-with-cms-energy-corp-stake,https://s3.amazonaws.com/gurufocus_userupload/1785413952948301824.png,en,2024-04-30 22:01:37+00:00,gurufocus.com,,AAPL
2024-05-30,69bded87-04b1-4f68-bc4b-5b90151c4ac1,Dow Jones Futures: Fed Inflation Report Due After Key Stock Market Sector Dives; Dell Plunges Late,Dow Jones futures: The plunging software sector hit the key stock market indexes. Dell dived late. The Fed's favorite inflation report looms.,,"Dow Jones futures edged lower after hours, along with S&P 500 futures and Nasdaq futures, heading into the Fed's key inflation report. Dell Technologies (DELL) ...",https://www.investors.com/market-trend/stock-market-today/dow-jones-futures-fed-inflation-report-due-key-sector-dives-dell-plunges/,https://www.investors.com/wp-content/uploads/2021/04/Stock-inflation-01-adobe.jpg,en,2024-05-30 20:51:23+00:00,investors.com,,AAPL
2024-05-30,128d6293-0502-4eaa-b0dc-afcc1eb863b0,"Warner Bros. Discovery: Moving Guidance From Buy To Hold, Q2 Results Okay (WBD)","The Warner Bros. Discovery spin-off has reached a valuation that makes sense to holders, but maybe not buyers. Read more on the arguments for both a rise and decline in WBD stock value.",,"Kevin Winter/Getty Images Entertainment

Above: Big movie premieres are fading as theatrical films with few exceptions generate the kind of excitement that turn...",https://seekingalpha.com/article/4696580-warner-bros-discovery-moving-guidance-from-buy-to-hold-q2-results-ok-but-no-game-changers,https://static.seekingalpha.com/cdn/s3/uploads/getty_images/53030069/image_53030069.jpg?io=getty-c-w1536,en,2024-05-30 21:39:01+00:00,seekingalpha.com,,AAPL
2024-05-30,c4d9affa-53ba-4733-ad6f-76ed3b6c6df3,Apple plans major AI update for Siri to give users more control over apps: Bloomberg,Apple is planning a major update for Siri that could allow users to control iPhone app features with their voice.,,Apple (NASDAQ:AAPL) is planning a major update for its virtual assistant Siri that could allow users to control specific app features on the iPhone with their v...,https://seekingalpha.com/news/4111799-apple-plans-major-ai-update-for-siri-to-give-users-more-control-over-apps-bloomberg,https://static.seekingalpha.com/cdn/s3/uploads/getty_images/1173509038/image_1173509038.jpg?io=getty-c-w750,en,2024-05-30 22:01:03+00:00,seekingalpha.com,,AAPL
2024-07-24,1b90eb3e-1268-4412-bc95-2f859fe69133,Morning Bid: A megacap tsunami coming your way By Reuters,Morning Bid: A megacap tsunami coming your way,,"(Reuters) - A look at the day ahead in Asian markets by Alden Bentley in New York

Brace for fallout from a megacap-led wipe out. A rethink of the earnings pict...",https://www.investing.com/news/economy-news/morning-bid-a-megacap-tsunami-coming-your-way-3535018,https://i-invdn-com.investing.com/news/indicatornews_1_800x533_L_1413124982.jpg,en,2024-07-24 21:51:42+00:00,investing.com,,AAPL
2024-07-24,bfc1a961-050f-4789-8c61-689bbb68f100,"Global Stocks Drop on AI Rethink, Yen Strengthens: Markets Wrap",Equities in Asia were set to decline as investors began to pullback on the artificial-intelligence frenzy that has powered the bull market this year.,,"This advertisement has not loaded yet, but your article continues below.

Global Stocks Drop on AI Rethink, Yen Strengthens: Markets Wrap Equities in Asia were ...",https://financialpost.com/pmn/business-pmn/global-stocks-drop-on-ai-rethink-yen-strengthens-markets-wrap,https://smartcdn.gprod.postmedia.digital/financialpost/wp-content/uploads/2024/07/sp-500-snaps-longest-streak-without2-drop-since2007-benchm.jpg,en,2024-07-24 22:58:50+00:00,financialpost.com,,AAPL
2024-07-24,7c8c3e19-0464-4fc8-b57a-b038fab540e9,"AI fever cools, wiping out $1.3 trillion on Nasdaq, with Tesla, Alphabet and more sinking",A growing number of market professionals argue that commercial hopes for AI are overblown. Read more at straitstimes.com.,,"SAN FRANCISCO – Investors soured on the promise of artificial intelligence (AI) on July 24, sparking a US$1 trillion (S$1.3 trillion) rout in the Nasdaq 100 i...",https://www.straitstimes.com/business/ai-fever-cools-wiping-out-13-trillion-on-the-nasdaq-stock-index,https://static1.straitstimes.com.sg/s3fs-public/styles/large30x20/public/articles/2024/07/25/2024-07-15T135223Z470349526RC2PT6A29Z9PRTRMADP3ONESTREAM-IPO.JPG?VersionId=OaOEhTslys3nON09A3OggFDEwak9XQwC,en,2024-07-24 23:15:00+00:00,straitstimes.com,,AAPL
2024-08-05,17ec9f5d-71e4-45eb-b522-c51f29263dca,S&P 500 Volatility Hits Highest Over Nasdaq 100 Since Pandemic,"In a day full of rare moves, S&P 500 options volatility spiked higher than the Nasdaq 100 for the first time since the Covid pandemic.","S&P 500 options, volatility, Nasdaq 100, VIX, VXN","(Bloomberg) -- In a day full of rare moves, S&P 500 options volatility spiked higher than the Nasdaq 100 for the first time since the Covid pandemic.

The Cboe ...",https://www.livemint.com/news/sp-500-volatility-hits-highest-over-nasdaq-100-since-pandemic-11722900237931.html,https://images.livemint.com/img/2018/12/28/1600x900/News_-_world_1545994908237.jpg,en,2024-08-05 23:23:57+00:00,livemint.com,,AAPL
2024-08-05,4c459876-773c-4e20-9634-3bd4f8726cf6,Apple Hospitality REIT (APLE) Q2 Earnings: Taking a Look at Key Metrics Versus Estimates,"Although the revenue and EPS for Apple Hospitality REIT (APLE) give a sense of how its business performed in the quarter ended June 2024, it might be worth considering how some key metrics compare with Wall Street estimates and the year-ago numbers.","stock, stocks, investment, investment advice, investing, online trading, online investment, online stock trading, stock market, financial, financial planning, quote, quotes, stock quotes","This page has not been authorized, sponsored, or otherwise approved or endorsed by the companies represented herein. Each of the company logos represented herei...",https://www.zacks.com/stock/news/2316564/apple-hospitality-reit-aple-q2-earnings-taking-a-look-at-key-metrics-versus-estimates?cid=CS-ZC-FT-fundamental_analysis|nfm-2316564,https://staticx-tuner.zacks.com/images/default_article_images/default304.jpg,en,2024-08-05 23:30:08+00:00,zacks.com,,AAPL
2024-08-05,d8412aaa-c619-4066-afbd-b4e58a486e3d,"Tech Stocks Lead Dow Jones Industrial Average To Largest Drop In Almost Two Years - Apple (NASDAQ:AAPL), Cisco Systems (NASDAQ:CSCO)","Stocks across the board fell on Monday due to concerns about a weakening US economy. The Dow dropped 2.6% while the S&P 500 and Nasdaq Composite also saw significant losses. Tech stocks, such as Intel and Apple, were among the biggest losers. Japanese stocks also saw a major decline, and oil prices fell as well. Traders are expecting the Fed to cut rates by half a point in September.",,"Stocks declined across the board on Monday as investors worried that the U.S. economy was weakening after Friday’s cooler-than-expected jobs report.

The Dow ...",https://www.benzinga.com/markets/asia/24/08/40175656/tech-stocks-lead-dow-jones-industrial-average-to-largest-drop-in-almost-two-years,https://cdn.benzinga.com/files/images/story/2024/08/05/Down-Crisis-Financial-Business-Market-Gr_0.jpeg?width=1200&height=800&fit=crop,en,2024-08-05 23:32:48+00:00,benzinga.com,,AAPL
2024-10-31,c61e57ad-fbda-4ddc-be00-11c9dca4e73a,"Apple Earnings: Q4 Results Decent, But Questions Continue Into Q1 2025 (NASDAQ:AAPL)",Apple reported Q4 2024 results that slightly beat estimates and provide some relief at face value. Click here to read an analysis of AAPL stock now.,,"As those who follow my account will know, I generally stay clear of writing on mega-caps. That's largely due to my desire to offer readers unique value in my wr...",https://seekingalpha.com/article/4731813-apple-earnings-q4-results-decent-but-questions-continue-into-q1-2025,https://static.seekingalpha.com/cdn/s3/uploads/getty_images/108108888/image_108108888.jpg?io=getty-c-w1536,en,2024-10-31 23:16:40+00:00,seekingalpha.com,,AAPL
2024-10-31,a899e8b5-7c5c-4c2c-b13e-2118eb25903f,Finding Long-Term Winners in Packaging and Exchange Stocks,,,"During their recent episode, Taylor, Carlisle, and George Livadis discussed Finding Long-Term Winners in Packaging and Exchange Stocks. Here’s an excerpt from...",https://acquirersmultiple.com/2024/10/finding-long-term-winners-in-packaging-and-exchange-stocks/,https://acquirersmultiple.com/wp-content/uploads/2015/06/rocketsquare_orange_175x175-100x100.png,en,2024-10-31 23:40:19+00:00,acquirersmultiple.com,,AAPL
2024-10-31,bf485805-b633-49bd-a79c-b88bda22a0b4,Apple Inc. (AAPL) Q4 2024 Earnings Call Transcript,"Apple Inc. (NASDAQ:AAPL) Q4 2024 Earnings Conference Call October 31, 2024 5:00 PM ETCompany ParticipantsSuhasini Chandramouli - Director, Investor...",,"Apple Inc. (NASDAQ:AAPL) Q4 2024 Earnings Conference Call October 31, 2024 5:00 PM ET

Company Participants

Suhasini Chandramouli - Director, Investor Relation...",https://seekingalpha.com/article/4731856-apple-inc-aapl-q4-2024-earnings-call-transcript,https://static.seekingalpha.com/assets/og_image_1200-29b2bfe1a595477db6826bd2126c63ac2091efb7ec76347a8e7f81ba17e3de6c.png,en,2024-10-31 23:59:06+00:00,seekingalpha.com,,AAPL
2024-11-15,59ecbc76-40d2-4430-b6b9-100224a752e0,Attorney Mina Haque Shares Her Successful M&A Strategy That Made Her CEO Of Tony Roma’s,Attorney Mina Haque shares how her competitive M&A strategy helped her land a role as Tony Roma's first female CEO.,"Mina Haque, M&A Strategy","Mina Haque, founder and principal attorney of the Washington, D.C.-based Law Office of Mohaimina ... [+] Haque PLLC and CEO of Tony Roma's. Courtesy of Mina Haq...",https://www.forbes.com/sites/yolarobert1/2024/11/15/attorney-mina-haque-shares-her-successful-ma-strategy-that-made-her-ceo-of-tony-romas/,https://imageio.forbes.com/specials-images/imageserve/6737ce66252d0ed6cd606207/0x0.jpg?format=jpg&height=900&width=1600&fit=bounds,en,2024-11-15 22:47:34+00:00,forbes.com,,AAPL
2024-11-15,ad58b422-70c1-42cb-b99b-f8702d514b62,S&P revises Ireland's outlook on Apple back-tax boost; Fitch affirms ratings By Reuters,S&P revises Ireland's outlook on Apple back-tax boost; Fitch affirms ratings,,"(Reuters) - S&P Global Ratings revised Ireland's outlook to ""positive"" from ""stable"" on Friday, citing extraordinary fiscal overperformance, sustained economic ...",https://www.investing.com/news/economy-news/sp-revises-irelands-outlook-to-positive-on-fiscal-overperformance-apple-backtax-boost-3726692,https://i-invdn-com.investing.com/news/indicatornews_4_800x533_L_1413112066.jpg,en,2024-11-15 22:50:36+00:00,investing.com,,AAPL
2024-11-15,1055e7de-5954-4705-ad44-9c6874d27a1e,Nasdaq Experiences Largest Weekly Drop Since September; Disney and Palantir Surge,"The three major U.S. stock indices closed lower, with the Nasdaq Composite dropping 2.24%, resulting in a 3.15% decline for the week. The S&P 500 fell 1.32% and","GuruFocus, Article, News, GuruFocus News, DIS","The three major U.S. stock indices closed lower, with the Nasdaq Composite dropping 2.24%, resulting in a 3.15% decline for the week. The S&P 500 fell 1.32% and...",https://www.gurufocus.com/news/2606699/nasdaq-experiences-largest-weekly-drop-since-september-disney-and-palantir-surge,https://static.gurufocus.com/logos/0C000009L1.png?20,en,2024-11-15 23:30:10+00:00,gurufocus.com,,AAPL
