date_requested,uuid,title,description,keywords,snippet,url,image_url,language,published_at,source,ticker,sentiment_score
2/22/24,69b60748-be89-4797-8354-74bcc1221c6a,OpenAI CEO Sam Altman stands to net millions as Reddit goes public,Sam Altman used Reddit every day for years before leading a $50 million round in the online discussion board company. Now Reddit sees ChatGPT as competition.,"Enterprise, Breaking News: Technology, Technology, Business, Microsoft Corp, Asana Inc, Instacart (Maplebear Inc), business news","OpenAI CEO Sam Altman will be in a position to make millions after Reddit goes public, thanks to a series of bets on the online discussion board company that go...",https://www.cnbc.com/2024/02/22/openai-ceo-sam-altman-stands-to-net-millions-as-reddit-goes-public.html,https://image.cnbcfm.com/api/v1/image/107377219-1708643334862-gettyimages-1933965269-DAVOS_WEF_2024.jpeg?v=1708643423&w=1920&h=1080,en,2024-02-22 23:28:30+00:00,cnbc.com,MSFT,0.7845
2/22/24,e19661e6-e94e-45a4-93eb-c1bee27ea900,Adobe: Do Not Ignore Figma And The Long-Term Gen AI Threat (NASDAQ:ADBE),"Adobe Inc. stock underperforms market, cancels Figma acquisition. Questions remain on its high valuation. Click for my ADBE update amidst all the turmoil.",,"Frazao Studio Latino/E+ via Getty Images

Adobe Inc. (NASDAQ:ADBE) was a big winner in 2023, as the company benefited from both a broader tech recovery as well ...",https://seekingalpha.com/article/4672663-adobe-do-not-ignore-figma-and-the-long-term-gen-ai-threat,https://media.gettyimages.com/id/1480560243/photo/young-man-drawing-on-a-paper-at-tattoo-studio.jpg?b=1&s=170667a&w=0&k=20&c=GNDNhW7iRflZA1N8IV1mSAq1LBlbzugd9Yh8x3DBk-U=,en,2024-02-22 23:44:08+00:00,seekingalpha.com,MSFT,0.3612
2/22/24,313bde6b-3443-4bd7-b625-15f9008d89ef,Earnings call: Ipsos reports solid growth with strategic tech investments By Investing.com,Earnings call: Ipsos reports solid growth with strategic tech investments,,"Published Feb 22, 2024 06:45PM ET

© Reuters.

IPSp 0.00% Add to/Remove from Watchlist

In the latest Earnings Call, Ipsos, the global market research firm, ha...",https://www.investing.com/news/stock-market-news/earnings-call-ipsos-reports-solid-growth-with-strategic-tech-investments-93CH-3312239,https://i-invdn-com.investing.com/news/LYNXNPEAB20I9_L.jpg,en,2024-02-22 23:45:50+00:00,investing.com,MSFT,0.4336
3/5/24,f88b8800-f19e-4873-adab-6607fd33a5ea,"‘Magnificent Seven’ shed $233 billion in market cap, dragging down stock market","‘This isn’t some panic selling,’ says Michael Sansoterra, chief investment officers at Silvant Capital Management","article_normal, magnificentseven, stockmarket, Financial Investment Services, Portfolio/Fund/Asset Management, Market Research/Public Relations, Public Relations, Internet Search Engines, Advertising/Marketing/Public Relations, Business/Consumer Services, Financial Services, Online Service Providers, Investing/Securities, Technology, Financial Performance, Corporate/Industrial News, Equity Markets, Debt/Bond Markets, Derivative Securities, Commodity/Financial Market News, Content Types, Factiva Filters, C&E Exclusion Filter, C&E Industry News Filter, MagnificentSeven, Apple Inc., AAPL, Amazon.com Inc., AMZN, Microsoft Corp., MSFT, NVIDIA Corp., NVDA, Tesla Inc., TSLA, Alphabet Inc. Cl A, GOOGL, Alphabet Inc. Cl C, GOOG, Meta Platforms Inc., META, NASDAQ Composite Index, COMP, S&P 500 Index, SPX, Dow Jones Industrial Average, DJIA, financial performance, corporate, industrial news, equity markets, debt, bond markets, derivative securities, commodity, financial market news, content types, factiva filters, c&e exclusion filter, c&e industry news filter, financial investment services, portfolio, fund, asset management, market research, public relations, internet search engines, advertising, marketing, business, consumer services, financial services, online service providers, investing, securities, technology","It has been a not-so magnificent Tuesday.

The “Magnificent Seven” group of technology companies that have helped underpin the stock-market rally for months...",https://www.marketwatch.com/story/magnificent-seven-shed-233-billion-in-market-cap-dragging-down-the-stock-market-d71f4f68?g=3d1778e3-98c2-4afa-a306-038a450ad4be&mod=mw_rss_bulletins,https://images.mktw.net/im-19977052/social,en,2024-03-05 22:21:26+00:00,marketwatch.com,MSFT,0.7506
3/5/24,4ad9573e-9020-44cd-9e18-c9c24b522c5c,"Market Today: CrowdStrike Soars on Earnings Beat, ChargePoint Tumbles After Disappointing Results","Market Overview The stock market experienced a downturn, with major indices falling over 1.0%, led by a decline in tech stocks. The drop was more pronounced in","GuruFocus, Article, News, GuruFocus Research, CRWD, CHPT, TSLA, AAPL, JWN, MDB, ROST, ARDX, PLTR, SOFI, ALB, BOX","Market Overview

The stock market experienced a downturn, with major indices falling over 1.0%, led by a decline in tech stocks. The drop was more pronounced in...",https://www.gurufocus.com/news/2373691/market-today-crowdstrike-soars-on-earnings-beat-chargepoint-tumbles-after-disappointing-results,https://static.gurufocus.com/1732803573856661504.png,en,2024-03-05 22:40:28+00:00,gurufocus.com,MSFT,0.6369
3/5/24,0883e662-3559-47e7-885d-f872f948b893,Asia Stocks Set for Mixed Open After US Tech Slide: Markets Wrap,Stocks in Asia were set for a mixed open after tech heavyweights dragged down US indexes in the run-up to Federal Reserve Chair Jerome Powell’s testimony to…,,"This advertisement has not loaded yet, but your article continues below.

Asia Stocks Set for Mixed Open After US Tech Slide: Markets Wrap Stocks in Asia were s...",https://financialpost.com/pmn/business-pmn/asia-stocks-set-for-mixed-open-after-us-tech-slide-markets-wrap,https://smartcdn.gprod.postmedia.digital/financialpost/wp-content/uploads/2024/03/us-spot-etfs-help-drive-bitcoin-to-a-record-high.jpg,en,2024-03-05 23:07:09+00:00,financialpost.com,MSFT,0.2023
3/12/24,723dd36a-65cb-4c53-b6ea-00bbb7f0b511,10 Best Alternatives to Amazon Echo and Alexa,"In this article, we will list the 10 best alternatives to Amazon Echo and Alexa. If you want to skip our detailed analysis of the Internet of Things and Artificial Intelligence industry, go to 5 Best Alternatives to Amazon Echo and Alexa. Internet of Things (IoT) refers to a network of interconnected physical objects, devices, […]",,"In this article, we will list the 10 best alternatives to Amazon Echo and Alexa. If you want to skip our detailed analysis of the Internet of Things and Artific...",https://finance.yahoo.com/news/10-best-alternatives-amazon-echo-224437007.html?.tsrc=rss,https://s.yimg.com/ny/api/res/1.2/SCHDCVtujfqNO_3S5s23ng--/YXBwaWQ9aGlnaGxhbmRlcjt3PTEyMDA7aD04MDM-/https://media.zenfs.com/en/insidermonkey.com/fa047dc9147dab502d76dc7f4cab5de6,en,2024-03-12 22:44:37+00:00,finance.yahoo.com,MSFT,0.5817
3/12/24,783c6c3d-e3ca-4ef5-8fba-9913e9dff367,"Identiv, Inc. (INVE) Q4 2023 Earnings Call Transcript","Identiv, Inc. (NASDAQ:NASDAQ:INVE) Q4 2023 Earnings Conference March 12, 2024 5:00 PM ETCompany ParticipantsSteven Humphreys - Chief Executive OfficerJustin...",,"Identiv, Inc. (NASDAQ:INVE) Q4 2023 Earnings Conference March 12, 2024 5:00 PM ET

Company Participants

Steven Humphreys - Chief Executive Officer

Justin Scar...",https://seekingalpha.com/article/4677752-identiv-inc-inve-q4-2023-earnings-call-transcript,https://static.seekingalpha.com/assets/og_image_1200-29b2bfe1a595477db6826bd2126c63ac2091efb7ec76347a8e7f81ba17e3de6c.png,en,2024-03-12 23:47:05+00:00,seekingalpha.com,MSFT,-0.5391
3/12/24,796f8fbb-c821-4b7e-948f-82e79017e5db,US stock futures steady after post-CPI rally; More inflation cues on tap By Investing.com,US stock futures steady after post-CPI rally; More inflation cues on tap,,"Published Mar 12, 2024 07:59PM ET

© Reuters.

US500 +1.12% Add to/Remove from Watchlist DJI +0.61% Add to/Remove from Watchlist BA -4.29% Add to/Remove from W...",https://www.investing.com/news/stock-market-news/us-stock-futures-steady-after-postcpi-rally-more-inflation-cues-on-tap-3335177,https://i-invdn-com.investing.com/news/LYNXMPEA7Q0M3_L.jpg,en,2024-03-12 23:59:57+00:00,investing.com,MSFT,0.34
3/14/24,4d9e762e-f6d4-4100-8071-d9de235346af,Market Open: Brace yourselves for ASX200 fall,Futures have been pointing to a 0.7 per cent drop after all US markets closed in the red off the back of higher-than-expected inflation data.,,"Join our daily newsletter At The Bell to receive exclusive market insights

ASX200 investors: Brace yourselves for market falls today!

Futures have been pointi...",https://themarketonline.com.au/market-open-brace-yourselves-for-asx200-fall-2024-03-15/,https://themarketonline.com.au/wp-content/uploads/2024/02/og-49094-Thumb-MO-1280x720.jpg,en,2024-03-14 22:18:45+00:00,themarketherald.com.au,MSFT,0.5859
3/14/24,cc835514-5889-4799-bd15-23c3371143fd,"Market Today: FDA Approves First NASH Therapy, Adobe and Ulta Beauty Report Earnings","Market Overview
The stock market experienced a downturn, with the S&P 500 (-0.3%), Nasdaq Composite (-0.3%), and Dow Jones Industrial Average (-0.4%) all closin","GuruFocus, Article, News, GuruFocus Research, MDGL, ADBE, ULTA, AAPL, ARCC, GERN, KODK, MO, VLO, PD, PATH, CDLX, BA, ENPH, AAPL, MSFT, AMZN, GOOG","Market Overview

The stock market experienced a downturn, with the S&P 500 (-0.3%), Nasdaq Composite (-0.3%), and Dow Jones Industrial Average (-0.4%) all closi...",https://www.gurufocus.com/news/2383968/market-today-fda-approves-first-nash-therapy-adobe-and-ulta-beauty-report-earnings,https://static.gurufocus.com/1732803573856661504.png,en,2024-03-14 22:40:31+00:00,gurufocus.com,MSFT,0.73955
3/14/24,55a27104-36c0-4f92-8175-7a115022fb75,"Earnings call: Turtle Beach acquires PDP, projects growth in 2024 By Investing.com","Earnings call: Turtle Beach acquires PDP, projects growth in 2024",,"Published Mar 14, 2024 07:51PM ET

© Reuters.

HEAR +26.47% Add to/Remove from Watchlist

Turtle Beach (NASDAQ: ), a leading gaming accessory brand, has announ...",https://www.investing.com/news/stock-market-news/earnings-call-turtle-beach-acquires-pdp-projects-growth-in-2024-93CH-3339136,https://i-invdn-com.investing.com/news/LYNXNPEB9M0BY_L.jpg,en,2024-03-14 23:51:33+00:00,investing.com,MSFT,0.6402
4/30/24,1bfb08df-92ce-4b76-a691-1b456fb92fd4,Jim Cramer says GE Healthcare's unwarranted post-earnings plunge is a buying opportunity,"Every weekday, the Investing Club releases the Homestretch; an actionable afternoon update just in time for the last hour of trading.","Homestretch, Breaking News: Markets, Markets, Investment strategy, Jim Cramer, Dow Jones Industrial Average, NASDAQ Composite, S&P 500 Index, GE HealthCare Technologies Inc, Constellation Brands Inc, Molson Coors Beverage Co, Eli Lilly and Co, Eaton Corporation PLC, Amazon.com Inc, Starbucks Corp, McDonald's Corp, Microsoft Corp, Alphabet Inc, Interest Rates, Inflation, Health care industry, Breaking News: Business, Retail industry, business news","Every weekday, the CNBC Investing Club with Jim Cramer releases the Homestretch — an actionable afternoon update, just in time for the last hour of trading on...",https://www.cnbc.com/2024/04/30/cramer-gehcs-unwarranted-post-earnings-plunge-is-a-buying-opportunity.html,https://image.cnbcfm.com/api/v1/image/107399547-1712781262762-gettyimages-2148193067-eid402813_sskypqgz.jpeg?v=1714502057&w=1920&h=1080,en,2024-04-30 18:35:08+00:00,cnbc.com,MSFT,0.3182
4/30/24,4f208976-aa85-45b4-be86-0a0ebfc9927c,"Wall Street stocks fall as markets weigh strong wage data, Fed meeting","U.S. stocks traded lower
on Tuesday as markets weighed economic data showing rising labor
costs and deteriorating consumer confidence on the eve of a key
Federal Reserve policy meeting to decide the...",Markets,"* Amazon set to report results after the bell

* Eli Lilly jumps after raising annual profit forecast

* McDonald's gains despite rare profit miss

* Indexes do...",https://www.marketscreener.com/quote/currency/AUSTRALIAN-DOLLAR-US-DOLL-2373531/news/Wall-Street-stocks-fall-as-markets-weigh-strong-wage-data-Fed-meeting-46585449/,https://img.zonebourse.com/reuters/2016-11/2016-11-23T211715Z_1_LYNXMPECAM1G5_RTROPTP_2_USA.JPG,en,2024-04-30 18:49:30+00:00,marketscreener.com,MSFT,0.1531
4/30/24,20575def-bcc5-4ef4-bcdf-1909ebd8da43,AMD Reports First Quarter 2024 Financial Results,"SANTA CLARA, Calif., April 30, 2024 (GLOBE NEWSWIRE) -- AMD (NASDAQ:AMD) today announced revenue for the first quarter of 2024 of $5.5 billion, gross margin of 47%, operating income of $36 million, net income of $123 million and diluted earnings per share of $0.07. On a non-GAAP(*) basis, gross margin was 52%, operating income was $1.1 billion, net income was $1.0 billion and diluted earnings per share was $0.62. “We delivered strong first quarter results with our Data Center and Client segments",,"Advanced Micro Devices, Inc.

SANTA CLARA, Calif., April 30, 2024 (GLOBE NEWSWIRE) -- AMD (NASDAQ:AMD) today announced revenue for the first quarter of 2024 of ...",https://finance.yahoo.com/news/amd-reports-first-quarter-2024-201500114.html?.tsrc=rss,https://media.zenfs.com/en/globenewswire.com/701ad71f57aa227c300d55d9cf75787e,en,2024-04-30 20:15:00+00:00,finance.yahoo.com,MSFT,0.45245
5/30/24,c254ef8b-c6e8-4156-ac00-736f68a55c0d,The Birth of Microsoft: A New Era in Computing,"On April 4, 1975, a groundbreaking event took place in Albuquerque, New Mexico, that would shape the future of computing. Bill Gates and Paul Allen founded Microsoft Corporation with a vision to…",,"The Birth of Microsoft: A New Era in Computing Black · Follow 2 min read · Just now Just now -- Listen Share

On April 4, 1975, a groundbreaking event took pl...",https://medium.com/@joinblacktechies/the-birth-of-microsoft-a-new-era-in-computing-99adfb1ba853,https://miro.medium.com/v2/resize:fit:597/1*dFD1M6Oy4BxSmu2tRR4b3g@2x.jpeg,en,2024-05-30 21:56:23+00:00,medium.com,MSFT,0.303783
5/30/24,b35af77c-549d-4fa4-96b2-16453f635126,US stocks fall as several large tech names retreat,"Dow Jones Industrial Average finishes down 0.9 per cent at 38,111.48. Read more at straitstimes.com.",,"NEW YORK - Wall Street stocks fell for a second straight session on May 30, following a downgrade in a US growth report as several large tech shares tumbled.

T...",https://www.straitstimes.com/business/companies-markets/us-stocks-fall-as-several-large-tech-names-retreat,https://static1.straitstimes.com.sg/s3fs-public/styles/large30x20/public/articles/2024/05/31/2024-05-30T172133Z424333834RC2DE7ACO3E0RTRMADP3USA-STOCKS-SETTLEMENT.JPG?VersionId=55TRcXP6FrEcl0W0KwS0.j8apMaKgoyr,en,2024-05-30 22:29:15+00:00,straitstimes.com,MSFT,0.1779
5/30/24,e2ae468d-6ea2-4fec-a0ed-7f9e28093082,"Market Today: Salesforce Plunge, Dell Drop, and Nvidia Licensing Issues","Market Performance
The major indices closed with solid losses despite an underlying positive bias today. The market-cap weighted S&P 500 fell 0.6% while the equ","GuruFocus, Article, News, GuruFocus Research, AAPL, AMZN, CRM, DELL, NVDA, AMD, MRVL, COST, ULTA, MDB, ZS, MPW, -77%(consensus-05%);Priorwasrevisedto36%from34%</li>
</ul><h3>Friday'sEconomicCalendar</h3>
<ul>
<li>8","Market Performance

The major indices closed with solid losses despite an underlying positive bias today. The market-cap weighted S&P 500 fell 0.6% while the eq...",https://www.gurufocus.com/news/2449287/market-today-salesforce-plunge-dell-drop-and-nvidia-licensing-issues,https://static.gurufocus.com/1732803573856661504.png,en,2024-05-30 22:32:30+00:00,gurufocus.com,MSFT,-0.2064
7/24/24,2eec20ea-5da2-4a85-94de-3410135ded94,"ASX Market Open: AI doubts fuel worst US session in nearly 2 years | 25 July, 2024",The ASX200 is staring down losses of 0.8 per cent after the Nasdaq & S&P 500 took their biggest hits since late 2022.,,"Join our daily newsletter At The Bell to receive exclusive market insights

The ASX200 is staring down losses of 0.8 per cent after the Nasdaq & S&P 500 took th...",https://themarketonline.com.au/asx-market-open-ai-doubts-fuel-worst-us-session-in-nearly-2-years-25-july-2024-2024-07-25/,https://themarketonline.com.au/wp-content/uploads/2024/02/49094-Thumb-MO-1280x720-e1721689789746.jpg,en,2024-07-24 23:00:06+00:00,themarketherald.com.au,MSFT,-0.2732
7/24/24,7c8c3e19-0464-4fc8-b57a-b038fab540e9,"AI fever cools, wiping out $1.3 trillion on Nasdaq, with Tesla, Alphabet and more sinking",A growing number of market professionals argue that commercial hopes for AI are overblown. Read more at straitstimes.com.,,"SAN FRANCISCO – Investors soured on the promise of artificial intelligence (AI) on July 24, sparking a US$1 trillion (S$1.3 trillion) rout in the Nasdaq 100 i...",https://www.straitstimes.com/business/ai-fever-cools-wiping-out-13-trillion-on-the-nasdaq-stock-index,https://static1.straitstimes.com.sg/s3fs-public/styles/large30x20/public/articles/2024/07/25/2024-07-15T135223Z470349526RC2PT6A29Z9PRTRMADP3ONESTREAM-IPO.JPG?VersionId=OaOEhTslys3nON09A3OggFDEwak9XQwC,en,2024-07-24 23:15:00+00:00,straitstimes.com,MSFT,0.76115
7/24/24,df72941b-6f76-4fd7-ad32-6c073ae839b8,"Cybersecurity firms responsible for their products’ reliability, stability: LGMS chairman",KUALA LUMPUR: Cybersecurity companies must prioritise deploying updates and software patches in stages to prevent widespread issues such as the recent...,john gilbert,KUALA LUMPUR: Cybersecurity companies must prioritise deploying updates and software patches in stages to prevent widespread issues such as the recent global in...,https://thesun.my/business-news/cybersecurity-firms-responsible-for-their-products-reliability-stability-lgms-chairman-JC12769101,https://thesun.my/binrepository/480x339/0c45/480d250/none/11808/SXGG/lgms-fiong-choong-fook-z_4378610_20240724212453.jpg,en,2024-07-24 23:30:00+00:00,thesundaily.my,MSFT,-0.4767
8/5/24,ceb166c0-3ffd-4828-941d-c3d9d58d5fe1,"PLAYSTUDIOS Inc (MYPS) Q2 2024 Earnings: Revenue Misses Estimates at $72.6M, GAAP EPS at -$0.02","Revenue: $72.6 million, fell short of estimates of $74.56 million and down from $77.8 million in the same quarter last year.Net Loss: $2.6 million, compared to","GuruFocus, Article, News, GuruFocus Research, MYPS","On August 5, 2024, PLAYSTUDIOS Inc (MYPS, Financial) released its 8-K filing announcing the financial results for the second quarter ended June 30, 2024. The co...",https://www.gurufocus.com/news/2492737/playstudios-inc-myps-q2-2024-earnings-revenue-misses-estimates-at-726m-gaap-eps-at-002,https://static.gurufocus.com/logos/0C0000C6I3.png?5,en,2024-08-05 21:58:23+00:00,gurufocus.com,MSFT,0.872
8/5/24,99471ddd-ff4b-4512-a536-3e4f57205de0,FTQI: Unconvincing Buy-Write ETF (NASDAQ:FTQI),First Trust Nasdaq BuyWrite Income ETF invests at least 80% of its net assets in the components of the Nasdaq Composite Index. Learn more on FTQI here.,,"Klaus Vedfelt

This article series aims at evaluating ETFs (exchange-traded funds) regarding the relative past performance of their strategies and metrics of th...",https://seekingalpha.com/article/4710622-ftqi-unconvincing-buy-write-etf,https://static.seekingalpha.com/cdn/s3/uploads/getty_images/1253985645/image_1253985645.jpg?io=getty-c-w1536,en,2024-08-05 22:15:40+00:00,seekingalpha.com,MSFT,0.1523
8/5/24,9e89df3a-b5ae-4451-ae0a-4f1a34366303,Big Tech Traders Brace for More Swings as Selloff Turns Violent,"For months investors have faced a dilemma — pay through the nose for technology giants trading at eye-watering multiples, or wait for a cheaper entry point and risk missing out on the year’s biggest bull run.","Bloomberg, investors, tech companies, earnings, Nasdaq 100","(Bloomberg) -- For months investors have faced a dilemma — pay through the nose for technology giants trading at eye-watering multiples, or wait for a cheaper...",https://www.livemint.com/news/big-tech-traders-brace-for-more-swings-as-selloff-turns-violent-11722898407554.html,https://images.livemint.com/img/2018/12/28/1600x900/News_-_world_1545994908237.jpg,en,2024-08-05 22:53:26+00:00,livemint.com,MSFT,0.9196
10/31/24,377a91e6-a6fa-479e-a4ea-8857904addcf,"ASX Market Open: US tech retreat leads local bourse lower | November 1, 2024",The ASX 200 is tipped to drop 0.6% to end the week after Wall Street tumbled on earnings reports from several tech giants.,,"Join our daily newsletter At The Bell to receive exclusive market insights

The ASX 200 is tipped to drop 0.6% to end the week after Wall Street tumbled on earn...",https://themarketonline.com.au/asx-market-open-us-tech-retreat-leads-local-bourse-lower-november-1-2024-2024-11-01/,https://themarketonline.com.au/wp-content/uploads/2024/02/49094-Thumb-MO-1280x720-e1725577078375.jpg,en,2024-10-31 21:43:13+00:00,themarketherald.com.au,MSFT,0.34385
10/31/24,7b82beef-755e-45a6-814a-569b67a9e864,Tech Stocks: Staying Ahead Of The Curve,What happens when growth numbers for tech names start coming down? Joe Albano and Victor Dergunov dissect recent news and how the Presidential election will affect the sector.,,"NanoStockk/iStock via Getty Images

Listen here or on the go via Apple Podcasts and Spotify

What happens when growth numbers for tech names start coming down? ...",https://seekingalpha.com/article/4731811-tech-stocks-staying-ahead-of-the-curve,https://static.seekingalpha.com/cdn/s3/uploads/getty_images/1288440805/image_1288440805.jpg?io=getty-c-w1536,en,2024-10-31 22:30:00+00:00,seekingalpha.com,MSFT,0.538933
10/31/24,b39e64eb-c2bd-4625-b622-b87e7ab6f658,BlackRock launches ETF that expands beyond the 'Magnificent Seven',BlackRock's iShares is targeting investors who want to diversify beyond from the,"Consumer banking, JPMorgan Chase & Co, Exchange-traded funds, Stock markets, Wall Street, Markets, Investment strategy, iShares Top 20 U.S. Stocks ETF, Apple Inc, Amazon.com Inc, Meta Platforms Inc, Alphabet Inc, Microsoft Corp, NVIDIA Corp, Tesla Inc, NASDAQ Composite, CNBC Magnificent 7 Index, S&P 500 Index, Personal investing, iPhone, Earnings, Technology, BlackRock Inc, business news","BlackRock's iShares is trying to appeal to investors who want to diversify beyond from the so-called Magnificent Seven.

The firm launched the iShares Top 20 U....",https://www.cnbc.com/2024/10/31/megacap-tech-gets-new-blackrock-etf.html,https://image.cnbcfm.com/api/v1/image/106871431-1618995206523-gettyimages-1230188826-AFP_8XC7VA.jpeg?v=1730403801&w=1920&h=1080,en,2024-10-31 23:13:43+00:00,cnbc.com,MSFT,0.6808
11/15/24,d9bba847-7814-43ac-92f5-1cb71a4c64a9,"Stock Market Recap: S&P 500 Falls as Post-Election Rally Fades on November 15, 2024","The stock market closed lower on Friday, November 15, 2024, as the post-election rally that had propelled major indexes to record highs earlier in the week",,"Market Overview: Major Indexes Post Weekly Losses

The stock market closed lower on Friday, November 15, 2024, as the post-election rally that had propelled maj...",https://thestockmarketwatch.com/stock-market-news/stock-market-recap-sp-500-falls-as-post-election-rally-fades-on-november-15-2024/48409/,https://thestockmarketwatch.com/stock-market-news/wp-content/uploads/2024/08/5.jpg,en,2024-11-15 22:01:45+00:00,thestockmarketwatch.com,MSFT,0.0772
11/15/24,85d38b1d-8a31-468f-b2cb-d5852ba9a8e1,TSLA and SpaceX Lead Market; AMD Announces Workforce Reduction,"Tesla (TSLA) topped U.S. market trading volume, closing up 3.07% with a turnover of $43.232 billion. Reports indicate that Elon Musk's SpaceX plans a stock sale","GuruFocus, Article, News, GuruFocus News, AMD","Tesla (TSLA) topped U.S. market trading volume, closing up 3.07% with a turnover of $43.232 billion. Reports indicate that Elon Musk's SpaceX plans a stock sale...",https://www.gurufocus.com/news/2606659/tsla-and-spacex-lead-market-amd-announces-workforce-reduction,https://static.gurufocus.com/logos/0C0000099E.png?20,en,2024-11-15 22:30:14+00:00,gurufocus.com,MSFT,0
11/15/24,1055e7de-5954-4705-ad44-9c6874d27a1e,Nasdaq Experiences Largest Weekly Drop Since September; Disney and Palantir Surge,"The three major U.S. stock indices closed lower, with the Nasdaq Composite dropping 2.24%, resulting in a 3.15% decline for the week. The S&P 500 fell 1.32% and","GuruFocus, Article, News, GuruFocus News, DIS","The three major U.S. stock indices closed lower, with the Nasdaq Composite dropping 2.24%, resulting in a 3.15% decline for the week. The S&P 500 fell 1.32% and...",https://www.gurufocus.com/news/2606699/nasdaq-experiences-largest-weekly-drop-since-september-disney-and-palantir-surge,https://static.gurufocus.com/logos/0C000009L1.png?20,en,2024-11-15 23:30:10+00:00,gurufocus.com,MSFT,0.1779
12/18/24,56a83cc2-7a8a-48c5-9d74-a0cc80a9dfbc,Saylor Doubles Down: MicroStrategy’s Bitcoin Buying Spree Continues,In a recent appearance on,,"In a recent appearance on “Bloomberg Open Interest,” MicroStrategy (MSTR) co-founder and executive chairman Michael Saylor discussed the company’s aggress...",https://wallstreetpit.com/121542-saylor-doubles-down-microstrategys-bitcoin-buying-spree-continues/,https://wallstreetpit.com/wp-content/uploads/2024/12/microstrategy-Saylor2-G.jpg,en,2024-12-18 21:10:45+00:00,wallstreetpit.com,MSFT,0.34925
12/18/24,21513fd5-2a75-4618-89f2-12c7b3c73cda,Market Recap: Stocks Tumble as Fed Signals Fewer Rate Cuts in 2025,"The U.S. stock market experienced a significant downturn on Wednesday, December 18, 2024, as investors reacted to the Federal Reserve's latest policy decision",,"Why Was the Market Down Today? Fed’s Cautious Stance Shakes Investor Confidence

The U.S. stock market experienced a significant downturn on Wednesday, Decemb...",https://thestockmarketwatch.com/stock-market-news/market-recap-stocks-tumble-as-fed-signals-fewer-rate-cuts-in-2025/48588/,https://thestockmarketwatch.com/stock-market-news/wp-content/uploads/2024/08/5.jpg,en,2024-12-18 22:01:35+00:00,thestockmarketwatch.com,MSFT,0.6486
