date_requested,uuid,title,description,keywords,snippet,url,image_url,language,published_at,source,ticker,sentiment_score
12/18/24,c7299034-5553-4467-a54d-35b8b4115acd,"Qualcomm saw Nuvia buy as chance to save $1.4 billion a year on Arm fees, CEO tells jury By Reuters","Qualcomm saw Nuvia buy as chance to save $1.4 billion a year on Arm fees, CEO tells jury",,"By Tom Hals

WILMINGTON, Delaware (Reuters) - Internal Qualcomm (NASDAQ: ) documents showed the chip firm estimated it could eventually save as much as $1.4 bil...",https://www.investing.com/news/stock-market-news/qualcomm-saw-nuvia-buy-as-chance-to-save-14-billion-a-year-on-arm-fees-ceo-tells-jury-3780773,https://i-invdn-com.investing.com/news/LYNXMPEA6M0X8_L.jpg,en,2024-12-18 23:59:35+00:00,investing.com,MSFT,0.802
1/15/25,ca8ec18a-1520-4969-b4aa-f771a04b75c6,Best AI Stocks to Hold in 2025,"Stocks Analysis by The Tokenist (Timothy Fries) covering: JPMorgan Chase & Co, Alphabet Inc Class A, Qualcomm Incorporated, Amazon.com Inc. Read The Tokenist (Timothy Fries)'s latest article on Investing.com",,"Owing to a stronger-than-expected jobs report for December, at 256,000 job gains vs 160,000 expected, the Fed’s interest cuts are no longer a certainty for 20...",https://www.investing.com/analysis/best-ai-stocks-to-hold-in-2025-200656273,https://i-invdn-com.investing.com/redesign/images/seo/investingcom_analysis_og.jpg,en,2025-01-15 20:31:00+00:00,investing.com,MSFT,-0.2263
1/15/25,d671a6ec-b5c7-41b2-a9f9-992138a701ee,NASDAQ snaps five-day losing streak with its best day since November 6,NASDAQ up 2.43% at close,,The major stock indices cheered on the combined PPI and CPI data with sharp gains in the major indices. The NASDAQ index snapped its five day losing streak (-4....,https://www.forexlive.com/news/nasdaq-snaps-five-day-losing-streak-with-its-best-day-since-november-6-20250115/,https://images.forexlive.com/fl-static/fl-thumbnail.jpg,en,2025-01-15 21:13:08+00:00,forexlive.com,MSFT,0.3608
1/15/25,b2573e1a-574a-409e-aab7-1f4a50d6a2c8,Market Recap: Stocks Surge on Cooler Inflation Data and Strong Bank Earnings,"On Wednesday, January 15, 2025, U.S. stock markets experienced a robust rally, with all major indexes posting significant gains. The surge was fueled by a",,"Major Indexes Post Significant Gains

On Wednesday, January 15, 2025, U.S. stock markets experienced a robust rally, with all major indexes posting significant ...",https://thestockmarketwatch.com/stock-market-news/market-recap-stocks-surge-on-cooler-inflation-data-and-strong-bank-earnings/48749/,https://thestockmarketwatch.com/stock-market-news/wp-content/uploads/2024/08/5.jpg,en,2025-01-15 22:28:36+00:00,thestockmarketwatch.com,MSFT,0.7351
1/22/25,a4e1cb00-ae8f-45fc-b183-1fa858c78c44,Market Surge: S&P 500 Hits Record High as Tech Stocks and AI Investments Lead the Way,"In a bullish trading session on Wednesday, January 22, 2025, the U.S. stock market demonstrated remarkable strength, with the S&P 500 reaching a new",,"In a bullish trading session on Wednesday, January 22, 2025, the U.S. stock market demonstrated remarkable strength, with the S&P 500 reaching a new all-time hi...",https://thestockmarketwatch.com/stock-market-news/market-surge-sp-500-hits-record-high-as-tech-stocks-and-ai-investments-lead-the-way/48789/,https://thestockmarketwatch.com/stock-market-news/wp-content/uploads/2024/08/5.jpg,en,2025-01-22 22:28:41+00:00,thestockmarketwatch.com,MSFT,0.6474
1/22/25,f22ddc3a-3c6e-4462-af85-3130d80350a0,5 US Stocks That Could Skyrocket After Trump’s Inauguration,"With Donald Trump starting his second Presidential term of office on 20 January, we look at five stocks that could benefit from his policies.",,"It’s interesting times in the US political scene once again as Donald Trump was inaugurated for his second term on 20 January.

The fiery politician is herald...",https://thesmartinvestor.com.sg/5-us-stocks-that-could-skyrocket-after-trumps-inauguration/,https://thesmartinvestor.com.sg/wp-content/uploads/2025/01/Donald-Trump.jpg,en,2025-01-22 23:30:00+00:00,thesmartinvestor.com.sg,MSFT,0.62285
1/22/25,3d11ddc7-ae2e-4d4c-8ebf-be7998135693,Nvidia supplier SK Hynix clocks bumper Q4 profit on AI-fueled chip demand By Investing.com,Nvidia supplier SK Hynix clocks bumper Q4 profit on AI-fueled chip demand,,"Investing.com-- Nvidia supplier SK Hynix Inc (KS: ) posted a sharp increase in its fourth-quarter profit on Thursday, as the memory chip maker benefited from in...",https://www.investing.com/news/stock-market-news/nvidia-supplier-sk-hynix-clocks-bumper-q4-profit-on-aifueled-chip-demand-3825917,https://i-invdn-com.investing.com/news/SKHynix_800x533_L_1648193506.jpg,en,2025-01-22 23:50:12+00:00,investing.com,MSFT,0
1/28/25,c869eab7-0d37-4866-a017-1a47f799bc7f,"Dow Jones Futures: 10 AI Stock Buys As Tesla, Microsoft, Meta, Fed Decision Loom","Dow Jones futures: The stock market rallied with many AI stocks flashing buy signals. Microsoft, Meta, Tesla and the Fed loom Wednesday.",,"Stock Market Bounces After AI Bloodbath; CrowdStrike Breaks Out, Leads Another Software Rally

9:36 AM ET The Nasdaq bounced 2% in the stock market Tuesday as e...",https://www.investors.com/market-trend/stock-market-today/dow-jones-futures-10-ai-stock-buys-tesla-microsoft-meta-fed-decision/,https://www.investors.com/wp-content/uploads/2024/11/Stock-cyberbulltitan-genAI-01-adobe.jpg,en,2025-01-28 22:44:28+00:00,investors.com,MSFT,-0.2263
1/28/25,0afdae3a-5e8b-493c-9ef8-59de56ebb2f8,Wall Street tumbles amid DeepSeek challenge,Wall Street experiences a significant decline as DeepSeek presents a new financial challenge.,,World shares are mostly lower after Wall Street edged back from its record highs on Monday. US stock futures sank as investors weighed a significant challenge f...,https://www.under30ceo.com/wall-street-tumbles-amid-deepseek-challenge/,https://cdn.under30ceo.com/wp-content/uploads/2025/01/cevj8lpbjsc.jpg,en,2025-01-28 22:50:00+00:00,under30ceo.com,MSFT,-0.1531
1/28/25,f13c8e80-41e0-4900-bdbd-821c18244d5b,NVIDIA’s $600 Billion Wipeout: How DeepSeek’s AI Breakthrough Reshaped the Tech Landscape,"In a shocking turn of events, NVIDIA Corporation has faced an unprecedented $600 billion drop in market value, marking the largest single-day loss in U.S. stock market history. The surprising…",,NVIDIA’s $600 Billion Wipeout: How DeepSeek’s AI Breakthrough Reshaped the Tech Landscape What's Trending · Follow 3 min read · Just now Just now -- Liste...,https://medium.com/@WTPlaybook/nvidias-600-billion-wipeout-how-deepseek-s-ai-breakthrough-reshaped-the-tech-landscape-409740d60424,https://miro.medium.com/v2/resize:fit:1200/1*MeGrrMd_zJgGjDfJAQznAA.jpeg,en,2025-01-28 23:02:10+00:00,medium.com,MSFT,-0.6705
1/30/25,061544b0-e0d7-46ad-88b9-fcf0d31428a6,Market Recap: S&P 500 Rises Amid Tech Earnings and Economic Data,"As of Thursday, January 30, 2025, the U.S. stock market displayed a mixed performance, with the S&P 500 and Nasdaq Composite showing gains while the Dow",,"Major Indexes Show Mixed Performance

As of Thursday, January 30, 2025, the U.S. stock market displayed a mixed performance, with the S&P 500 and Nasdaq Composi...",https://thestockmarketwatch.com/stock-market-news/market-recap-sp-500-rises-amid-tech-earnings-and-economic-data/48831/,https://thestockmarketwatch.com/stock-market-news/wp-content/uploads/2024/08/5.jpg,en,2025-01-30 22:01:43+00:00,thestockmarketwatch.com,MSFT,0.402
1/30/25,1618cda2-6c59-4e01-9740-21ac57649816,"Market Recap: S&P 500, Nasdaq, and Dow Jones Close Lower as Fed Holds Rates Steady","In today's market recap for Thursday, January 30, 2025, we'll cover the performance of major market indexes, upcoming market events, and significant stock",,"In today’s market recap for Thursday, January 30, 2025, we’ll cover the performance of major market indexes, upcoming market events, and significant stock n...",https://thestockmarketwatch.com/stock-market-news/market-recap-sp-500-nasdaq-and-dow-jones-close-lower-as-fed-holds-rates-steady/48832/,https://thestockmarketwatch.com/stock-market-news/wp-content/uploads/2024/08/5.jpg,en,2025-01-30 22:29:35+00:00,thestockmarketwatch.com,MSFT,0.6121
1/30/25,0f9530ee-7abc-475e-9403-528160fdcedb,U.S. Stock Market’s Shocking Plunge: Is This Just the Beginning?,"The U.S. stock market has been on a rollercoaster ride, but its latest drop sent shockwaves through Wall Street. At the heart of the turmoil? A massive sell-off in tech stocks, triggered by a…",,"The U.S. stock market has been on a rollercoaster ride, but its latest drop sent shockwaves through Wall Street. At the heart of the turmoil? A massive sell-off...",https://medium.com/@thanusan940s/u-s-stock-markets-shocking-plunge-is-this-just-the-beginning-043f17ce3bad,https://miro.medium.com/v2/resize:fit:700/1*6CWqDo-7P-jEW2aPXcodpg@2x.jpeg,en,2025-01-30 23:44:01+00:00,medium.com,MSFT,-0.1061
3/5/25,060add8c-8a63-4e1f-a73b-56546996b8eb,iCAD and RamSoft Announce Partnership to Deliver ProFound® AI-Powered Mammography Solutions Across North America,**media[558390]**,"iCAD, and, RamSoft, Announce, Partnership, to, Deliver, ProFound®, AI-Powered, Mammography, Solutions, Across, North, America","NASHUA, N.H. and TORONTO, March 05, 2025 (GLOBE NEWSWIRE) -- iCAD, Inc. (NASDAQ: ICAD) a global leader in clinically proven AI-powered cancer detection solution...",https://www.manilatimes.net/2025/03/06/tmt-newswire/globenewswire/icad-and-ramsoft-announce-partnership-to-deliver-profound-ai-powered-mammography-solutions-across-north-america/2068061,https://www.manilatimes.net/manilatimes/uploads/images/2025/03/06/558390.jpg,en,2025-03-05 19:22:00+00:00,manilatimes.net,MSFT,0.5859
3/5/25,c708d490-65b9-4c41-85fa-f96993ef0c35,Marc Benioff: Microsoft (MSFT) Will Not Use OpenAI Because It’s ‘Too Expensive’ For Them,The AI stocks selloff that started following the launch of DeepSeek is still impacting the US markets.,,"We recently published a list of 10 AI News You Can’t Miss. In this article, we are going to take a look at where Microsoft Corporation (NASDAQ:MSFT) stands ag...",https://www.insidermonkey.com/blog/marc-benioff-microsoft-msft-will-not-use-openai-because-its-too-expensive-for-them-1472747/,https://d2gr5kl7dt2z3t.cloudfront.net/blog/wp-content/uploads/2015/05/shutterstock_191358239.jpg,en,2025-03-05 20:20:18+00:00,insidermonkey.com,MSFT,0.281283
3/5/25,a60e4f90-1b16-411c-83d6-64adc06f245a,Zoom Stock: Leading the Video Market After Skype’s Exit,Stocks Analysis by MarketBeat.com (Gabriel Osorio-Mazzilli) covering: Zoom Video Communications Inc. Read MarketBeat.com (Gabriel Osorio-Mazzilli)'s latest article on Investing.com,,"As the digital economy starts to go online across businesses and the world, investors have to be aware of the companies and services that will be at the forefro...",https://www.investing.com/analysis/zoom-stock-leading-the-video-market-after-skypes-exit-200657991,https://i-invdn-com.investing.com/redesign/images/seo/investingcom_analysis_og.jpg,en,2025-03-05 20:41:00+00:00,investing.com,MSFT,0
3/10/25,4cc513c7-28ec-474c-a261-eb52715683c9,Market Plunge: Tech Stocks Lead Selloff Amid Recession Fears,"On Monday, March 10, 2025, U.S. stock markets experienced a significant downturn, with technology stocks leading the selloff amid growing concerns about a",,"On Monday, March 10, 2025, U.S. stock markets experienced a significant downturn, with technology stocks leading the selloff amid growing concerns about a poten...",https://thestockmarketwatch.com/stock-market-news/market-plunge-tech-stocks-lead-selloff-amid-recession-fears/49008/,https://thestockmarketwatch.com/stock-market-news/wp-content/uploads/2024/08/5.jpg,en,2025-03-10 21:01:48+00:00,thestockmarketwatch.com,MSFT,-0.296
3/10/25,bc441e74-5796-473e-886c-dd52a014131c,The Bubble is Bursting,Lessons from the 2000 bubble can tell us what comes next.,,"The Bubble is Bursting

In 2000, Sun Microsystems was one of the hottest stocks in the world.

Sun seemed to have everything going for it. They were a leader in...",https://dailyreckoning.com/the-bubble-is-bursting/,https://dailyreckoning.com/wp-content/uploads/2025/03/dr-hero-img-03-10-25.jpg,en,2025-03-10 22:01:37+00:00,dailyreckoning.com,MSFT,0.9136
3/10/25,72fd79a3-4a44-47e3-806d-99b1b8af7933,U.S. Stock Market Plummets Amid Tariff Policy Concerns,"Investors are increasingly worried about the uncertainty surrounding tariff policies, leading to significant declines in U.S. stock markets. The three major ind","GuruFocus, Article, News, GuruFocus News, AAPL","Investors are increasingly worried about the uncertainty surrounding tariff policies, leading to significant declines in U.S. stock markets. The three major ind...",https://www.gurufocus.com/news/2734528/us-stock-market-plummets-amid-tariff-policy-concerns,https://static.gurufocus.com/logos/0C00000ADA.png?20,en,2025-03-10 23:50:20+00:00,gurufocus.com,MSFT,-0.0258
3/14/25,5bd37527-97ce-466e-8935-1d13b5590e85,"Market Rebounds Sharply After Correction: End-of-Day Recap for March 14, 2025","In a dramatic turnaround, U.S. stocks staged a significant rebound on Friday, March 14, 2025, following a tumultuous week that saw the S&P 500 enter",,"In a dramatic turnaround, U.S. stocks staged a significant rebound on Friday, March 14, 2025, following a tumultuous week that saw the S&P 500 enter correction ...",https://thestockmarketwatch.com/stock-market-news/market-rebounds-sharply-after-correction-end-of-day-recap-for-march-14-2025/49039/,https://thestockmarketwatch.com/stock-market-news/wp-content/uploads/2024/08/5.jpg,en,2025-03-14 21:01:54+00:00,thestockmarketwatch.com,MSFT,0.1779
3/14/25,1a54a290-6794-4deb-8a56-3fe010cdbfaa,"Market Recap: Stocks Rebound Sharply on Friday, March 14, 2025","In a dramatic turnaround, U.S. stocks rebounded sharply on Friday, March 14, 2025, marking their best performance of the year. This rally came after a",,"Major Indexes Stage Impressive Recovery

In a dramatic turnaround, U.S. stocks rebounded sharply on Friday, March 14, 2025, marking their best performance of th...",https://thestockmarketwatch.com/stock-market-news/market-recap-stocks-rebound-sharply-on-friday-march-14-2025/49040/,https://thestockmarketwatch.com/stock-market-news/wp-content/uploads/2024/08/5.jpg,en,2025-03-14 21:28:37+00:00,thestockmarketwatch.com,MSFT,0.7964
3/14/25,479544bd-bfb2-4db5-aa3d-b433149f09fe,UBS Reiterates ‘Buy’ on Microsoft Corporation (MSFT) Despite Azure Growth Concerns,"Celestial AI™, creator of the Photonic Fabric™ optical interconnect technology platform, recently announced that it has raised an additional $250 million in venture capital, bringing its total raised...",,"Artificial intelligence is the greatest investment opportunity of our lifetime. The time to invest in groundbreaking AI is now, and this stock is a steal!

The ...",https://www.insidermonkey.com/blog/ubs-reiterates-buy-on-microsoft-corporation-msft-despite-azure-growth-concerns-1482420/,https://d2gr5kl7dt2z3t.cloudfront.net/blog/wp-content/uploads/2023/09/19152304/MSFT-insidermonkey-1695151382226.jpg,en,2025-03-14 22:22:18+00:00,insidermonkey.com,MSFT,-0.1202
3/28/25,26cbb6e1-744d-4ac0-b573-3e1ee8bb7e19,"Trump was supposed to unlock IPO market, but CoreWeave debut reflects ongoing skepticism","After pricing its IPO below the expected range, CoreWeave's stock didn't do much in its debut on Friday, reflecting concerns about the macro environment.","CoreWeave Inc, Amazon.com Inc, Alphabet Inc, Microsoft Corp, NVIDIA Corp, Technology, Business, Social media, Breaking News: Technology, Goldman Sachs Group Inc, Donald J. Trump, Breaking News: Politics, Politics, Venture capital, IPO, business news","CoreWeave Inc. signage during the company's initial public offering at the Nasdaq MarketSite in New York, US, on Friday, March 28, 2025.

It wasn't supposed to ...",https://www.cnbc.com/2025/03/28/trump-was-supposed-to-unlock-ipos-coreweave-debut-reflects-skepticism.html,https://image.cnbcfm.com/api/v1/image/108122853-1743173894028-gettyimages-2206660254-COREWEAVE_IPO.jpeg?v=1743173994&w=1920&h=1080,en,2025-03-28 20:19:42+00:00,cnbc.com,MSFT,-0.5859
3/28/25,103cfdc9-9104-4722-8f69-06d207d8051c,Market Recap: Stocks Plunge on Inflation Fears and Tariff Concerns,"The stock market experienced a significant downturn on Friday, March 28, 2025, as investors grappled with hotter-than-expected inflation data and growing",,"The stock market experienced a significant downturn on Friday, March 28, 2025, as investors grappled with hotter-than-expected inflation data and growing concer...",https://thestockmarketwatch.com/stock-market-news/market-recap-stocks-plunge-on-inflation-fears-and-tariff-concerns/49117/,https://thestockmarketwatch.com/stock-market-news/wp-content/uploads/2024/08/5.jpg,en,2025-03-28 21:02:01+00:00,thestockmarketwatch.com,MSFT,0.2263
3/28/25,6c2240b0-81f0-4405-9207-90b5f14a6841,US Stocks Plunge Amid Rising Inflation and Trade Uncertainty,U.S. stock markets faced significant sell-offs due to rising inflation and global trade policy uncertainties. The Dow Jones Industrial Average dropped as much a,"GuruFocus, Article, News, GuruFocus News, AAPL",U.S. stock markets faced significant sell-offs due to rising inflation and global trade policy uncertainties. The Dow Jones Industrial Average dropped as much a...,https://www.gurufocus.com/news/2755289/us-stocks-plunge-amid-rising-inflation-and-trade-uncertainty,https://static.gurufocus.com/logos/0C00000ADA.png?20,en,2025-03-28 21:40:15+00:00,gurufocus.com,MSFT,-0.25
4/4/25,98d16cfc-8329-4c18-9b2b-6989035f3788,"Former Microsoft CEO Steve Ballmer says, as shareholder, tariffs are 'not good'","Despite tariff impact, Microsoft's top shareholder said he's a long-term believer in the company, given its opportunity in compute and intelligence.","Breaking News: Politics, Microsoft Corp, Business, Technology, Breaking News: Technology, Enterprise, Politics, business news","Steve Ballmer, former chief executive officer of Microsoft Corp., speaks during an event commemorating the 50th anniversary of the company at Microsoft headquar...",https://www.cnbc.com/2025/04/04/former-microsoft-ceo-steve-ballmer-on-trump-tariffs-not-good.html,https://image.cnbcfm.com/api/v1/image/108126998-1743795925801-gettyimages-2207879590-MICROSOFT_COPILOT.jpeg?v=1743795967&w=1920&h=1080,en,2025-04-04 21:04:26+00:00,cnbc.com,MSFT,0.341271
4/4/25,d415a232-a123-4425-b8fe-fb46798d3c74,Market Today: Tech Giants Eye Government Contracts Amid Tariff Turmoil,"Market Overview
This week witnessed a significant downturn in U.S. equity markets, primarily driven by escalating trade tensions and recession fears. President","GuruFocus, Article, News, GuruFocus News, AAPL, AMZN, MSFT, ORCL, MRVL, ON, BA, LMT, NKE, LULU, DOW, LYB, 228K(consensus130K);Priorrevisedto117Kfrom151K</li>
<li>MarchNonfarmPrivatePayrolls","Market Overview

This week witnessed a significant downturn in U.S. equity markets, primarily driven by escalating trade tensions and recession fears. President...",https://www.gurufocus.com/news/2763753/market-today-tech-giants-eye-government-contracts-amid-tariff-turmoil,https://static.gurufocus.com/1732803573856661504.png,en,2025-04-04 22:32:24+00:00,gurufocus.com,MSFT,0.8402
4/4/25,9996b775-13f7-4f85-a777-cf49b0862569,Microsoft (MSFT) Gains Sector Outperform Rating from Scotiabank Amid AI Advances,"Key Highlights:
    Scotiabank initiates coverage of Microsoft Corp (MSFT) with a Sector Outperform rating.    Analysts project a significant upside for Microso","GuruFocus, Article, News, GuruFocus News, MSFT","Key Highlights:

Scotiabank initiates coverage of Microsoft Corp (MSFT, Financial) with a Sector Outperform rating.

Analysts project a significant upside for M...",https://www.gurufocus.com/news/2763811/microsoft-msft-gains-sector-outperform-rating-from-scotiabank-amid-ai-advances,https://static.gurufocus.com/logos/0C000008EC.png?20,en,2025-04-04 23:56:50+00:00,gurufocus.com,MSFT,0.372886
4/9/25,a72f9f21-17b5-407a-9991-701a3a66e3bb,Microsoft announces quarterly earnings release date,"PR NewswireREDMOND, Wash., April 9, 2025



REDMOND, Wash., April 9, 2025 /PRNewswire/ -- Microsoft Corp. will publish fiscal year 2025 third-quarter financia","GuruFocus, Article, News, PRNewswire, NAS:MSFT","REDMOND, Wash., April 9, 2025 /PRNewswire/ -- Microsoft Corp. will publish fiscal year 2025 third-quarter financial results after the close of the market on Wed...",https://www.gurufocus.com/news/2770005/microsoft-announces-quarterly-earnings-release-date,https://static.gurufocus.com/images/global_logo_twitter_card.png,en,2025-04-09 22:00:15+00:00,gurufocus.com,MSFT,0.274125
4/9/25,fbc932ba-d4db-4e5c-a483-a53fe2f76e4e,Market Today: Trump's Tariff Pause Sparks Historic Market Rally,"Market Overview
It was a significant day for the stock market, with major indices experiencing substantial gains. The Nasdaq Composite surged nearly 12%, the S&","GuruFocus, Article, News, GuruFocus News, TSLA, NVDA, BABA, AMZN, W, URBN, AAPL, STLA, MU, C, JPM, +267at6238</li>
<li>NaturalGas","Market Overview

It was a significant day for the stock market, with major indices experiencing substantial gains. The Nasdaq Composite surged nearly 12%, the S...",https://www.gurufocus.com/news/2770133/market-today-trumps-tariff-pause-sparks-historic-market-rally,https://static.gurufocus.com/1732803573856661504.png,en,2025-04-09 22:32:32+00:00,gurufocus.com,MSFT,0.6486
4/9/25,3b3c35a4-68bd-4f87-8428-afea8e0a9a03,Dow Jones: Double Bottom in Focus as Tariff Volatility Persists,"Market Analysis by  covering: Dow Jones Industrial Average, CBOE Volatility Index. Read 's Market Analysis on Investing.com",,"The Dow Jones is showing a potential double bottom pattern amid China’s retaliatory tariffs.

Volatility is high, with the S&P 500 experiencing a significant ...",https://www.investing.com/analysis/dow-jones-double-bottom-in-focus-as-tariff-volatility-persists-200659301,https://i-invdn-com.investing.com/redesign/images/seo/investingcom_analysis_og.jpg,en,2025-04-09 23:24:00+00:00,investing.com,MSFT,0.4391
4/16/25,17d82897-3b3c-4ad3-8548-6e2c02093125,Is Microsoft (MSFT) the Best NASDAQ Stock to Buy So Far in 2025?,We recently published a list of 13 Best NASDAQ Stocks to Buy So Far in 2025.,,"We recently published a list of 13 Best NASDAQ Stocks to Buy So Far in 2025. In this article, we are going to take a look at where Microsoft Corporation (NASDAQ...",https://www.insidermonkey.com/blog/is-microsoft-msft-the-best-nasdaq-stock-to-buy-so-far-in-2025-1509358/,https://d2gr5kl7dt2z3t.cloudfront.net/blog/wp-content/uploads/2023/09/19152304/MSFT-insidermonkey-1695151382226.jpg,en,2025-04-16 21:06:43+00:00,insidermonkey.com,MSFT,0.380071
4/16/25,f7c8ab35-c7e9-48c9-ba0f-17ee4978fed5,Tech Stocks Plunge as Fed Chair Powell Expresses Inflation Concerns,Federal Reserve Chair Jerome Powell expressed concerns about the central bank's challenge in balancing inflation control with economic growth. Following his rem,"GuruFocus, Article, News, GuruFocus News, AAPL",Federal Reserve Chair Jerome Powell expressed concerns about the central bank's challenge in balancing inflation control with economic growth. Following his rem...,https://www.gurufocus.com/news/2785258/tech-stocks-plunge-as-fed-chair-powell-expresses-inflation-concerns,https://static.gurufocus.com/logos/0C00000ADA.png?20,en,2025-04-16 22:10:11+00:00,gurufocus.com,MSFT,0
4/16/25,0432ccd6-9e4b-4177-80f4-9bdd4cf3a433,"Market Today: Nvidia and AMD Hit by Export Licensing, Fed's Tariff Concerns","Market Performance

Stocks faced significant selling pressure, resulting in sharp declines across major indices. The S&P 500 decreased by 2.2%, the Nasdaq Compo","GuruFocus, Article, News, GuruFocus News, AMZN, NVDA, AMD, COST, F, META, PLTR, ABT, BAX, JNJ, MDT, PGR, Consensus1418million;Prior1501million</li>
<li>BuildingPermits","Market Performance

Stocks faced significant selling pressure, resulting in sharp declines across major indices. The S&P 500 decreased by 2.2%, the Nasdaq Compo...",https://www.gurufocus.com/news/2785300/market-today-nvidia-and-amd-hit-by-export-licensing-feds-tariff-concerns,https://static.gurufocus.com/1732803573856661504.png,en,2025-04-16 22:32:20+00:00,gurufocus.com,MSFT,0.296
4/24/25,caee3df8-3c61-43fb-bf3a-fc827ec38c76,US Stocks Surge as Fed Rate Cut Speculations Boost Tech Sector,U.S. stock markets rallied with tech stocks leading the charge after Federal Reserve officials hinted at a potential rate cut in June. The Dow Jones Industrial,"GuruFocus, Article, News, GuruFocus News, NVDA",U.S. stock markets rallied with tech stocks leading the charge after Federal Reserve officials hinted at a potential rate cut in June. The Dow Jones Industrial ...,https://www.gurufocus.com/news/2803389/us-stocks-surge-as-fed-rate-cut-speculations-boost-tech-sector,https://static.gurufocus.com/logos/0C00000BXN.png?20,en,2025-04-24 22:50:16+00:00,gurufocus.com,MSFT,0.8625
4/24/25,38d73b75-3157-4f5c-8fc4-a2b4c512fec9,Jim Cramer credits this week's rally to earnings and restraint from the White House,CNBC's Jim Cramer analyzed recent market action.,"Jim Cramer, Stock markets, Investment strategy, Business, Markets, Microsoft Corp, Procter & Gamble Co, ServiceNow Inc, Texas Instruments Inc, GE Vernova Inc, GS Acquisition Holdings Corp, Meta Platforms Inc, Tesla Inc, Amazon.com Inc, NVIDIA Corp, NASDAQ Composite, S&P 500 Index, Dow Jones Industrial Average, PepsiCo Inc., business news",CNBC's Jim Cramer analyzed the market's rally over the past few sessions — which followed days of staggering losses — pointing to strong earnings results an...,https://www.cnbc.com/2025/04/24/jim-cramer-attributes-rally-to-earnings-less-noise-from-white-house.html,https://image.cnbcfm.com/api/v1/image/107076310-1655341006752-IMG_1949rbbb.jpg?v=1697582097&w=1920&h=1080,en,2025-04-24 23:02:52+00:00,cnbc.com,MSFT,0.6597
