date_requested,uuid,title,description,keywords,snippet,url,image_url,language,published_at,source,ticker,sentiment_score
4/24/25,03faf8d7-36b6-4c3e-b465-346fe6b6f7f8,"US stocks settle higher, Dow Jones above 40,000 pts","US stocks settle higher, Dow Jones above 40,000 pts","At Argaam Plus, you get up to date news on Saudi Stock Market tadawul, stock quotes, company performance, Market data and analysis. Top companies Sabic, Maaden, Banks, Petrochemicals","US stocks rose on Thursday, supported by strong performances from major technology companies, amid anticipation for any signs of easing trade tensions between W...",https://www.argaam.com/en/reports/international_market_daily_report/48567?preview=true,https://www.argaam.com/content/en/images/argaam-plus-social1.jpg,en,2025-04-24 23:12:00+00:00,argaam.com,MSFT,0
5/1/25,54580e1b-a132-4321-90cc-6c9bcdcdf070,TSM Leads Gains Among Mixed Performance in Chinese Stocks,"On Thursday, Chinese stocks listed in the U.S. showed mixed performance. The Nasdaq Golden Dragon China Index (HXC) rose by 0.22%. Among the gainers, Taiwan Sem","GuruFocus, Article, News, GuruFocus News, TSM","On Thursday, Chinese stocks listed in the U.S. showed mixed performance. The Nasdaq Golden Dragon China Index (HXC) rose by 0.22%. Among the gainers, Taiwan Sem...",https://www.gurufocus.com/news/2822295/tsm-leads-gains-among-mixed-performance-in-chinese-stocks,https://static.gurufocus.com/logos/0C00000CIF.png?20,en,2025-05-01 21:50:12+00:00,gurufocus.com,MSFT,0.8481
5/1/25,c500cbac-f19d-4f54-86fd-ad1a3a049809,Strong Earnings from MSFT and META Propel Nasdaq While Other Stocks React,"The U.S. stock market saw a robust rise as investors focused on major corporate earnings, alleviating economic slowdown concerns. The Nasdaq surged 264 points,","GuruFocus, Article, News, GuruFocus News, MSFT","The U.S. stock market saw a robust rise as investors focused on major corporate earnings, alleviating economic slowdown concerns. The Nasdaq surged 264 points, ...",https://www.gurufocus.com/news/2822811/strong-earnings-from-msft-and-meta-propel-nasdaq-while-other-stocks-react,https://static.gurufocus.com/logos/0C000008EC.png?20,en,2025-05-01 22:10:14+00:00,gurufocus.com,MSFT,0.2732
5/1/25,d7774412-c6e2-4cd4-8f9d-874927993f8d,"ASX Market Open: Australian market to drop despite tech-drive night of gains on Wall St | May 2, 2025","The Aussie stock market is set to open lower as we head towards the weekend and Federal election, despite an optimistic Wall Street",,"The ASX200 is set to open nearly a third of a percent lower (0.27%) despite a strong performance on Wall Street overnight, which was itself underpinned by Big T...",https://themarketonline.com.au/asx-market-open-australian-market-to-drop-despite-tech-drive-night-of-gains-on-wall-st-may-2-2025-2025-05-02/,https://themarketonline.com.au/wp-content/uploads/2025/04/MO-fall-e1745794722655.png,en,2025-05-01 22:56:53+00:00,themarketherald.com.au,MSFT,0.8968
5/2/25,b9054499-2491-46da-8509-1cd3cc3fc17e,S&P index closes up for the 9th day.,Major indices close higher for the second consecutive week.,,"The S&P is closing higher for the ninth consecutive day.

Since bottoming on April 21, the index is up 11.48%.

Looking at the other major indices, the NASDAQ i...",https://www.forexlive.com/stock-market-update/sp-index-closes-up-for-the-9th-day-20250502/,https://images.forexlive.com/fl-static/fl-thumbnail.jpg,en,2025-05-02 20:07:43+00:00,forexlive.com,MSFT,0.6647
5/2/25,65485eba-2ea5-4da9-bb5a-d533b2c46a42,S&P 500 Notches Longest Winning Streak Since 2004 As Stocks Claw Back From ‘Liberation Day’ Crash,"The AI trade is back in vogue, with the likes of Meta, Palantir and Tesla all gaining at least 20% during the historic rally.",,"Topline

Stocks rallied again Friday on a key data point showing strength in the U.S. economy and optimism about trade talks between the U.S. and China, sending...",https://www.forbes.com/sites/dereksaul/2025/05/02/sp-500-notches-longest-winning-streak-since-2004-as-stocks-claw-back-from-liberation-day-crash/,"https://imageio.forbes.com/specials-images/imageserve/6814e293ee7f558094f8c10f/0x0.jpg?format=jpg&crop=1486,836,x0,y76,safe&height=900&width=1600&fit=bounds",en,2025-05-02 20:08:09+00:00,forbes.com,MSFT,0.78875
5/2/25,f2aeb146-7745-4507-9552-bfa7fb55165f,"Wall Street sees 9th straight day of gains, reclaiming losses since Trump’s tariff escalation",The rally was spurred by a better-than-expected report on the U.S. job market and resurgent hope for a ratcheting down in the U.S. trade showdown with China.,,"Wall Street extended its gains to a ninth straight day Friday, marking the stock market’s longest winning streak since 2004 and reclaiming the ground it lost ...",https://www.pbs.org/newshour/economy/wall-street-sees-9th-straight-day-of-gains-reclaiming-losses-since-trumps-tariff-escalation,https://d3i6fh83elv35t.cloudfront.net/static/2025/05/2025-04-30T154600Z_992978364_RC2E8EA4A57Z_RTRMADP_3_USA-STOCKS-1024x683.jpg,en,2025-05-02 21:11:45+00:00,pbs.org,MSFT,0.4588
5/12/25,a114e7a0-7777-49f6-ba87-ddc0161de82f,"NioCorp CEO Mark Smith to Present to European Investors on May 16, 2025","Event Hosted in Antwerp Will Be Webcast Live CENTENNIAL, CO / ACCESS Newswire / May 12, 2025 / NioCorp Developments Ltd. (""NioCorp"" or the ""Company"") (NASDAQ:NB","GuruFocus, Article, News, ACCESSWIRE, NAS:NB","Event Hosted in Antwerp Will Be Webcast Live

CENTENNIAL, CO / ACCESS Newswire / May 12, 2025 / NioCorp Developments Ltd. (""NioCorp"" or the ""Company"") (NASDAQ:N...",https://www.gurufocus.com/news/2854224/niocorp-ceo-mark-smith-to-present-to-european-investors-on-may-16-2025,https://static.gurufocus.com/images/global_logo_twitter_card.png,en,2025-05-12 17:00:05+00:00,gurufocus.com,MSFT,0
5/12/25,7797dba2-bcce-487a-8894-6845a2caeba5,Left Field Labs and Hasbro Win Two Webby Awards for Twister AIR,"PR NewswireLOS ANGELES, May 12, 2025



Experience for Hasbro wins Internet's highest honor for Augmented Reality Game LOS ANGELES, May 12, 2025 /PRNewswire/","GuruFocus, Article, News, PRNewswire, NAS:STGW","Experience for Hasbro wins Internet's highest honor for Augmented Reality Game

LOS ANGELES, May 12, 2025 /PRNewswire/ -- Left Field Labs, a creative technology...",https://www.gurufocus.com/news/2854916/left-field-labs-and-hasbro-win-two-webby-awards-for-twister-air,https://static.gurufocus.com/images/global_logo_twitter_card.png,en,2025-05-12 20:00:03+00:00,gurufocus.com,MSFT,0.1779
5/12/25,1124c7df-fb2e-4312-a6ef-c09381090b3a,"Bezos, Musk And Zuckerberg Grow More Than $30 Billion Richer After Tariff Deal",The “dream scenario” for tech investors helped send the S&P 500 to its highest level since early March.,,"Topline Stocks surged across the board Monday as the U.S. and China’s trade war deescalated significantly, and the most valuable American companies largely sl...",https://www.forbes.com/sites/dereksaul/2025/05/12/us-china-tariff-thaw-sparks-stock-rally-making-bezos-musk-and-zuckerberg-more-than-40-billion-richer/,"https://imageio.forbes.com/specials-images/imageserve/66faf5efcad0a16211cdf36c/0x0.jpg?format=jpg&crop=1963,1310,x0,y158,safe&height=900&width=1600&fit=bounds",en,2025-05-12 20:22:57+00:00,forbes.com,MSFT,0.5859
5/27/25,f818cb8f-a8c5-4f82-b1e2-1a1546de8ce3,Alaska Communications Welcomes Yasir Alvi as CFO,"Experienced financial leader Yasir Alvi will join Alaska Communications as chief financial officer beginning June 2, 2025.
This press release features multimed","GuruFocus, Article, News, Business Wire, NAS:ATNI","Experienced financial leader Yasir Alvi will join Alaska Communications as chief financial officer beginning June 2, 2025.

This press release features multimed...",https://www.gurufocus.com/news/2889939/alaska-communications-welcomes-yasir-alvi-as-cfo,https://static.gurufocus.com/images/global_logo_twitter_card.png,en,2025-05-27 18:00:02+00:00,gurufocus.com,MSFT,0
5/27/25,38e9e6ed-293d-409c-ab7e-ba1f562629bf,Nvidia reports Q1 earnings this week: Here’s what to expect,"NVDA stock rises in anticipation of Nvidia's fiscal Q1 earnings report on Wednesday, May 28.",,"Nvidia’s earnings have become some of the most closely watched numbers on Wall Street. The company makes up about 6.5% of the Nasdaq 100, and 5.5% of the S&P ...",https://www.fastcompany.com/91341195/nvidia-reports-q1-earnings-this-week-heres-what-to-expect?partner=rss&amp;utm_source=rss&amp;utm_medium=feed&amp;utm_campaign=rss+fastcompany&amp;utm_content=rss,"https://images.fastcompany.com/image/upload/f_webp,q_auto,c_fit,w_1024,h_1024/wp-cms-2/2025/05/p-91341195-nvidia-earnings-may-2025.jpg",en,2025-05-27 19:30:00+00:00,fastcompany.com,MSFT,0.6733
5/27/25,62279cde-231a-4430-8fdb-fb7fc3c75c4f,Iceberg Research Predicts Downfall for The Metals Company (TMC) | TMC Stock News,"Iceberg Research has taken a short position against The Metals Company (TMC), a firm listed on Nasdaq that focuses on mining valuable metals like manganese, nic","GuruFocus, Article, News, GuruFocus News, TMC","Iceberg Research has taken a short position against The Metals Company (TMC, Financial), a firm listed on Nasdaq that focuses on mining valuable metals like man...",https://www.gurufocus.com/news/2890351/iceberg-research-predicts-downfall-for-the-metals-company-tmc-tmc-stock-news,https://static.gurufocus.com/images/global_logo_twitter_card.png,en,2025-05-27 20:16:12+00:00,gurufocus.com,MSFT,0.1779
7/31/25,8170c7b3-6533-459d-988e-adc29ed0d1a3,Tech Earnings Drive Market Volatility as Major Indexes Close Lower,"The U.S. stock market experienced a volatile trading session on Thursday, July 31, 2025, with major indexes ultimately closing lower despite an early surge",,"The U.S. stock market experienced a volatile trading session on Thursday, July 31, 2025, with major indexes ultimately closing lower despite an early surge fuel...",https://stockmarketwatch.com/stock-market-news/tech-earnings-drive-market-volatility-as-major-indexes-close-lower/51315/,https://stockmarketwatch.com/stock-market-news/wp-content/uploads/2025/07/smw-icon-1000x700-logo.png,en,2025-07-31 21:07:28+00:00,thestockmarketwatch.com,MSFT,0.66075
7/31/25,83dff73f-0525-47b8-b862-c2f464b99186,Investinglive Americas FX news wrap 31 Jul: Core PCE stays elevated at 2.8%.Stocks fall.,"Forex news for North American trading on Jul 31, 2025",,"In June, U.S. core PCE inflation rose 0.3% month-over-month, in line with expectations and marking the highest monthly gain since February, while the annual rat...",https://investinglive.com/news/investinglive-americas-fx-news-wrap-31-jul-core-pce-stays-elevated-at-28stocks-fall-20250731/,https://images.investinglive.com/images/wrap%20candles%203_id_e3b2ec8e-5de7-4f63-ab37-56f394dc2755_size975.jpg,en,2025-07-31 21:22:22+00:00,forexlive.com,MSFT,0.1683
7/31/25,0c9af76e-7df0-47f1-9e41-a08a9f6213a4,"Microsoft joins exclusive $4T market cap club after AI surge, joining only one other company",Microsoft joined Nvidia as only the second company to reach a $4 trillion market cap due to strong demand for artificial intelligence and cloud products,,"Microsoft touched $4 trillion in market cap Thursday, joining Nvidia as the only two companies to reach this level.

Ticker Security Last Change Change % MSFT M...",https://www.foxbusiness.com/markets/microsoft-hits-4-trillion-juicing-etfs-who-own-tech-giant,https://a57.foxnews.com/static.foxbusiness.com/foxbusiness.com/content/uploads/2025/07/0/0/gettyimages-2195894725.jpg?ve=1&tl=1,en,2025-07-31 22:54:38+00:00,foxbusiness.com,MSFT,0.382914
10/30/25,d9f46713-c150-414d-a783-b79af2744394,"Big Tech Tumbles, Metals Shine","[Chart courtesy of MarketWatch.com] Stocks slipped early on as tech earnings took center stage, with the S&P 500 and Nasdaq both retreating from recent highs. Alphabet provided a bright spot by rallying about 5% on better-than-expected results, but Meta Platforms and Microsoft tumbled roughly 12% and 2%, respectively, after their quarterly reports triggered investor worries over rising spending forecasts and ... Read More",,"[Chart courtesy of MarketWatch.com]

Moving the market

Stocks slipped early on as tech earnings took center stage, with the S&P 500 and Nasdaq both retreating ...",https://theetfbully.com/2025/10/big-tech-tumbles-metals-shine/,https://theetfbully.com/wp-content/uploads/2025/10/Thur-pic-4.png,en,2025-10-30 20:47:10+00:00,theetfbully.com,MSFT,0.6369
10/30/25,c985f526-ae18-419a-afc0-c85582b61b10,Tech Earnings and Fed Caution Drive Mixed Market Close on October 30th,"The U.S. stock market concluded Thursday, October 30, 2025, with a mixed performance, as investors grappled with a barrage of mixed signals from the latest",,"The U.S. stock market concluded Thursday, October 30, 2025, with a mixed performance, as investors grappled with a barrage of mixed signals from the latest roun...",https://stockmarketwatch.com/stock-market-news/tech-earnings-and-fed-caution-drive-mixed-market-close-on-october-30th/55334/,https://stockmarketwatch.com/stock-market-news/wp-content/uploads/2025/07/smw-icon-1000x700-logo.png,en,2025-10-30 21:07:57+00:00,thestockmarketwatch.com,MSFT,0.0919
10/30/25,2f090b1e-5c95-47f4-9968-7a1bc7ec7f65,"Microsoft: Q3 Earnings Were Flawless, Stock Is A Buy (MSFT)","Microsoft Corporation delivered strong fiscal Q1 '26 results, beating expectations on both EPS and revenue. Learn more about MSFT stock here.",,"Microsoft Corporation ( MSFT ) reported an all-around beat for fiscal Q1 '26 on October 29, but the market did not seem to love what they saw. The stock is trad...",https://seekingalpha.com/article/4835946-microsoft-q3-earnings-were-flawless-stock-is-a-buy,https://static.seekingalpha.com/cdn/s3/uploads/getty_images/2197050427/image_2197050427.jpg?io=getty-c-w1536,en,2025-10-30 23:27:40+00:00,seekingalpha.com,MSFT,0.08465
12/10/25,a73bf1ac-b6a7-4713-b58b-c7e379894b12,Oracle set to report quarterly results after the bell,Oracle's hefty infrastructure costs and rising debt load have weighed on the stock in the past few months.,"Larry Ellison, Alphabet Class A, Microsoft Corp, Amazon.com Inc, Enterprise, Technology, Business, Oracle Corp, Safra Catz, business news","Larry Ellison, Oracle's co-founder and chief technology officer, appears at the Formula One British Grand Prix in Towcester, U.K., on July 6, 2025.

Oracle is s...",https://www.cnbc.com/2025/12/10/oracle-orcl-q2-earnings-report-2026.html,https://image.cnbcfm.com/api/v1/image/108239404-1765319257574-gettyimages-2223383256-2025_F1_British_GP_556932.jpeg?v=1765319383&w=1920&h=1080,en,2025-12-10 17:10:09+00:00,cnbc.com,MSFT,0.0516
12/10/25,59ef70ac-ed10-4e51-a858-fd6647f69795,"Wall Street Lunch: 3rd Straight FOMC Cut, But Dissents Grow","As widely expected, the Federal Open Market Committee reduced its benchmark interest rate by 25 basis points on Wednesday, its third straight cut.",,"asbe/iStock via Getty Images

Listen below or on the go on Apple Podcasts and Spotify

This is an abridged transcript of the podcast:

As widely expected, the F...",https://seekingalpha.com/article/4852258-wall-street-lunch-3rd-straight-fomc-cut-but-dissents-grow,https://static.seekingalpha.com/cdn/s3/uploads/getty_images/2234483669/image_2234483669.jpg?io=getty-c-w1536,en,2025-12-10 21:45:00+00:00,seekingalpha.com,MSFT,0.128
12/10/25,335a6769-d3cf-421a-8e7c-ca401a034c86,Cisco's stock closes at record for first time since dot-com peak in 2000,"Cisco was at the center of the internet boom, but has a much different role in today's artificial intelligence craze.","Internet, Cisco Systems Inc, Business, Technology, Breaking News: Technology, Enterprise, Microsoft Corp, NVIDIA Corp, business news","Chuck Robbins, chief executive officer of Cisco, participates in a Bloomberg interview at the World Economic Forum in Davos, Switzerland, on Jan. 17, 2024.

Few...",https://www.cnbc.com/2025/12/10/ciscos-stock-closes-at-record-for-first-time-since-dot-com-peak-2000.html,https://image.cnbcfm.com/api/v1/image/107415547-1715802493761-gettyimages-1932183702-DAVOS_WEF_2024.jpeg?v=1765403389&w=1920&h=1080,en,2025-12-10 22:34:31+00:00,cnbc.com,MSFT,0.7152